臺北市士林區天母西路5巷4弄1號,25.11920402556292,121.5292259546202
臺北市北投區石牌路二段315巷10弄1號,25.122441478215684,121.52265451956261
臺北市信義區吳興街284巷59弄1號,25.022264594783305,121.56345132001269
臺北市松山區復興北路481號,25.064874000000003,121.54437931363604
臺北市信義區基隆路ㄧ段101巷1號,25.03293000000008,121.56705000000011
臺北市松山區三民路1號,25.05003000000005,121.57729000000006
臺北市信義區虎林街232巷31號,25.036351040798664,121.576734256593
臺北市內湖區星雲街15巷1號,25.077934760199668,121.59045057132558
臺北市中山區敬業三路161巷1號,25.079267503750916,121.55602886081135
臺北市內湖區安康路211號,25.066012924231057,121.61271231196264
臺北市內湖區內湖路一段323巷2弄1號,25.082564287943285,121.56729284219765
臺北市內湖區民權東路六段190巷61弄1號,25.06633508993588,121.59447565029716
臺北市中山區明水路571號,25.079792384235525,121.5520739605888
臺北市中山區建國北路一段23巷31號,25.047355452680474,121.5389202799065
臺北市中山區雙城街3巷1號,25.06337859972252,121.52447714168414
臺北市中山區長春路61號,25.05493950764605,121.52627119900166
臺北市南港區南港路三段47巷1號,25.052846420646667,121.59042028967667
臺北市信義區基隆路一段83巷31號,25.04668246378896,121.57106958964744
臺北市信義區嘉興街301號,25.023660000000064,121.55503001832197
臺北市北投區東華街二段31號,25.120760765769198,121.50792152850984
臺北市北投區中和街1號,25.13289000000003,121.50253000000009
臺北市中正區青島西路1號,25.044632946448054,121.51893346947314
臺北市萬華區寶興街65巷1號,25.02669792783773,121.49431826019969
臺北市文山區羅斯福路五段241號,25.00157664363206,121.53924399653754
臺北市大安區信義路二段44巷1號,25.033885397755864,121.52568770182691
臺北市大安區瑞安街208巷1號,25.028345377135278,121.54056763222067
臺北市大安區敦化南路一段187巷61號,25.042574503750917,121.5522595896474
臺北市士林區福林路361號,25.099227489961144,121.5363240903497
臺北市松山區民生東路四段80巷11弄1號,25.056670452680475,121.55321666472389
臺北市松山區健康路7巷1號,25.052796922557608,121.55240128489818
臺北市中山區松江路330巷1號,25.061151478215685,121.53264753136364
臺北市中山區明水路421號,25.077389489324194,121.54904986372554
臺北市中山區松江路511號,25.06945351234926,121.53359913546643
臺北市中山區敬業一路91號,25.083271378081303,121.55222181095934
臺北市大安區四維路14巷1號,25.036783522072778,121.54805077990653
臺北市中正區晉江街31號,25.042160000000024,121.51980000000003
臺北市中正區水源路61號,25.042160000000024,121.51980000000003
臺北市中正區汀州路二段91號,25.025342731057762,121.51801434332623
臺北市大安區復興南路一段313巷1號,25.034412478215692,121.54398679808412
臺北市內湖區內湖路一段1巷9弄31號,25.08622845406545,121.55770416541634
臺北市中山區伊通街31號,25.050339000000008,121.5350777514571
臺北市內湖區內湖路一段387巷1號,25.08254876002513,121.57034932835798
臺北市中山區林森北路421號,25.060386905492013,121.52562651360665
臺北市松山區復興北路499巷2弄1號,25.065569011656763,121.54502507216228
臺北市松山區八德路三段1號,25.048244012261765,121.55282731198892
臺北市北投區裕民三路1號,25.11617880904842,121.51606011226846
臺北市中正區忠孝東路一段1號,25.04556579049541,121.52071433709384
臺北市士林區中山北路六段181號,25.1076626611172,121.52499654717532
臺北市松山區三民路121號,25.056037049540137,121.56364922738604
臺北市松山區南京東路五段291巷5弄1號,25.051959471002334,121.56642028282073
臺北市中山區北安路571號,25.08101090536093,121.54845401511922
臺北市中山區中山北路二段26巷1號,25.054000376074796,121.5221987514571
臺北市中山區敬業一路1號,25.080119950160373,121.55312520756556
臺北市中正區金門街24弄1號,25.042160000000024,121.51980000000003
臺北市大安區安和路二段69巷1號,25.029631244367135,121.55046156246881
臺北市大安區臺北市忠孝東路四段181巷35弄1號,25.044004529286145,121.55089991909517
臺北市大安區信義路四段265巷1號,25.033534994171617,121.55437727699234
臺北市大安區忠孝東路三段251巷2弄1號,25.04209337607479,121.5415395
臺北市大安區忠孝東路三段217巷1弄1號,25.042320503462452,121.53959983236194
臺北市文山區和平東路四段61號,25.00560797921459,121.5671258960729
臺北市中山區臺北市林森北路331號,25.056394124617697,121.52555819706842
臺北市中山區八德路二段91號,25.046065854288923,121.53629528437177
臺北市中山區永康街23巷1號,25.03187536955243,121.53007746062939
臺北市信義區松仁路61號,25.031637723533144,121.56836587225156
臺北市信義區永吉路271號,25.045643092801633,121.57483457022839
臺北市北投區吉利街61號,25.11865968871982,121.50682789169541
臺北市中正區臺北市林森南路1號,25.042160000000024,121.51980000000003
臺北市大同區民生西路121號,25.05745220511851,121.51869534179701
臺北市士林區華齡街185巷1號,25.087595857060442,121.51940486441805
臺北市北投區實踐街31號,25.115143756592982,121.50853934984707
臺北市北投區中正街49巷31號,25.131601840961856,121.49986493118847
臺北市北投區行義路130巷1號,25.129235891482473,121.52863285567548
臺北市信義區富陽街44巷1號,25.022534238415354,121.5561081947025
臺北市信義區虎林街222巷31號,25.036823022476806,121.57656466556061
臺北市信義區福德街61號,25.036789935599355,121.58067873411618
臺北市信義區中坡南路1號,25.044173540040546,121.58205740040538
臺北市內湖區成功路四段61號,25.08192297584976,121.59226606647813
臺北市中山區長春路241號,25.054722471002336,121.53929827990652
臺北市文山區溪洲街5巷1號,25.005867590339907,121.53572299056498
臺北市文山區羅斯福路五段236巷1號,25.001238722985278,121.53786298062289
臺北市中山區中山北路二段53巷1號,25.052806211642928,121.52243309468653
臺北市內湖區文德路271號,25.079267040827336,121.58912541935494
臺北市南港區經貿二路241號,25.06043069845339,121.6148234957039
臺北市信義區永吉路278巷27弄31號,25.04460443825374,121.57507000582837
臺北市北投區光明路241號,25.136284155530813,121.5072456933185
臺北市大同區庫倫街1號,25.071981463788966,121.5170276960875
臺北市松山區市民大道四段151號,25.044754263402314,121.55091368082407
臺北市信義區大道路91號,25.040258255900504,121.58275619401
臺北市內湖區文湖街21巷98弄1號,25.09049148903573,121.55984958090482
臺北市內湖區成功路四段30巷31號,25.082415660280482,121.59189372967278
臺北市中山區松江路1號,25.064430000000073,121.53331000000003
臺北市中山區天津街31號,25.048749237578637,121.52263812184775
臺北市內湖區康寧路三段75巷186弄121號,25.075696599426447,121.61311698895263
臺北市大安區敦化南路二段211號,25.02645232835188,121.54901759807788
臺北市大安區金山南路二段185巷1號,25.0284452267586,121.52658390966013
臺北市中山區中山北路二段20巷1號,25.053576485429048,121.52218969900167
臺北市士林區中山北路六段151號,25.10665200394439,121.52478845131822
臺北市士林區忠誠路二段21巷1號,25.109170401726445,121.53054225689834
臺北市士林區福志路91號,25.09848580514231,121.52852762289314
臺北市士林區中庸二路1號,25.13486186649551,121.54804792437527
臺北市萬華區隆昌街31號,25.041265124617695,121.5051123090484
臺北市萬華區寶興街91號,25.025861682209012,121.49446691701768
臺北市萬華區西寧南路91號,25.045418011656764,121.50675753802874
臺北市松山區饒河街121號,25.050433452680462,121.5742280029142
臺北市信義區忠孝東路五段236巷45弄31號,25.037649854296337,121.57353510523045
臺北市松山區南京東路三段241號,25.051963042359866,121.54405908398681
臺北市松山區新東街61號,25.06198767325613,121.56510541866031
臺北市信義區光復南路415巷61號,25.03723298427522,121.55847519008728
臺北市士林區福華路181號,25.105340814528137,121.52149695682597
臺北市士林區天母北路28巷1號,25.12005665056035,121.52638255490564
臺北市中山區朱崙街91號,25.049924496537553,121.54330769608748
臺北市內湖區基湖路32巷2弄1號,25.080772651682132,121.56498772785514
臺北市中正區寧波西街91號,25.029741854635677,121.5148297250661
臺北市中正區潮州街1號,25.042160000000024,121.51980000000003
臺北市文山區木柵路三段61號,24.988607245080455,121.56663392561603
臺北市大安區敦化南路二段81巷31號,25.029953496537555,121.54992750000002
臺北市大安區信義路四段30巷27弄1號,25.032066496249097,121.54481588773154
臺北市大安區光復南路451號,25.035554671959147,121.55739848620061
臺北市大安區忠孝東路四段49巷4弄1號,25.02634000000006,121.5347700000001
臺北市大安區和平東路三段241號,25.022870696087477,121.55434896725143
臺北市大安區永康街12巷1號,25.031704285042405,121.5292123812107
臺北市中山區八德路二段271號,25.04704666556059,121.5415701566738
文德段五小段301號,25.04172452207278,121.54334836372556
臺北市內湖區內湖路一段629巷31號,25.080986892030733,121.57468774078129
臺北市中山區五常街31號,25.064356452680467,121.5384384446304
臺北市士林區莊頂路172巷31號,25.112775341941234,121.55497435775295
臺北市北投區臺北市裕民六路1號,25.113331643920514,121.51692275740106
臺北市中正區臨沂街32巷1號,25.039762825985303,121.52944286594726
臺北市大同區長安西路61號,25.050901334079832,121.51720100111974
臺北市大同區敦煌路80巷1號,25.07515670468582,121.51746817098497
臺北市松山區八德路三段12巷5弄1號,25.04771970205226,121.55079206393616
臺北市信義區忠孝東路五段524巷3弄1號,25.040778704974286,121.57976410338166
臺北市信義區忠孝東路五段331號,25.041013336509742,121.57411686666855
臺北市松山區慶城街1號,25.05247002611219,121.54458000000011
臺北市松山區延壽街361號,25.05654646378897,121.55876832361935
臺北市中正區杭州南路一段31號,25.041737064112187,121.52624572828783
臺北市大同區重慶北路二段91號,25.056631791563277,121.51393965321135
臺北市北投區大業路361號,25.131810048308843,121.49592248763842
臺北市中山區南京東路二段31號,25.052173522072774,121.52910600000001
臺北市大安區敦化南路一段151號,25.043858999999998,121.54915733917127
臺北市大安區辛亥路二段171巷1號,25.021745413266785,121.54108734638463
臺北市大安區和平東路三段1號,25.02381128339762,121.55325773899227
臺北市內湖區內湖路一段737巷61弄1號,25.08088054731954,121.57932496280802
臺北市內湖區文德路208巷6弄1號,25.077915000000004,121.58302500000002
臺北市信義區吳興街511號,25.023319729448676,121.56981715582704
新北市中和區景平路541號,24.999374525391,121.49865102178434
新北市永和區成功路一段61號,25.00359020260835,121.52707905107047
新北市中和區圓通路391號,24.98923009019568,121.49003577921405
新北市中和區景平路159巷1號,24.992163000000005,121.5126393208494
新北市中和區中和區南華路61號,24.997096267009006,121.50443117539967
新北市永和區中山路一段191巷1號,25.008530127132122,121.50938837296705
新北市永和區保福路二段109巷1弄1號,25.01298086790914,121.50917624464776
新北市中和區景平路361號,24.993397477927235,121.50455808090487
新北市土城區金城路三段33巷1號,24.986839463500505,121.46545510338167
新北市板橋區四川路一段121號,25.00493000000006,121.45981001110862
新北市汐止區康寧街885巷31號,25.076817335276132,121.65052767193725
新北市樹林區保安街三段1巷10弄1號,25.01005466274727,121.41033356436955
新北市新莊區中平路377巷17弄1號,25.05151251367428,121.44298148632572
新北市新莊區福德二街91號,25.057163290327566,121.46077146189731
新北市新莊區中華路二段121號,25.05036041548848,121.45280771481335
新北市新莊區中華路一段116巷1號,25.040788214785437,121.45260437430066
新北市新莊區中正路新建巷28弄61號,25.021163304749244,121.41369292798196
新北市汐止區和平街61號,25.070741780454767,121.6616020772982
新北市新莊區福美街31號,25.03568000000007,121.45046000000002
新北市新莊區福壽街124巷1號,25.051338456644338,121.45812975474595
新北市三重區三和路一段61號,25.06560336663973,121.50267560352586
新北市淡水區中山北路二段188巷1號,25.185258000000008,121.44499650000003
新北市淡水區中正路一段31號,25.176335027840302,121.42616749443192
新北市中和區建一路181號,24.99861051408439,121.48824501408437
新北市中和區中山路二段391號,25.004819536211038,121.48667815598134
新北市樹林區水源街32巷1號,24.9814122223152,121.4252062230077
新北市中和區安平路91號,24.99670952928614,121.51102413613025
新北市中和區連城路481號,24.995658049397008,121.48297445643139
新北市中和區景新街541號,24.999037617260107,121.50395577254892
新北市淡水區民權路61號,25.138881534277797,121.45977628478262
新北市淡水區中正路91號,25.169807850395348,121.44043513474527
新北市淡水區新市一路一段331號,25.186266527707655,121.43592763816676
新北市淡水區新市一路三段121號,25.183021514859423,121.44702625145709
新北市新店區碧潭路1號,24.956282684950324,121.5349711706965
新北市新店區復興路31號,24.986927206221125,121.53795281268346
新北市中和區民利街68巷5弄1號,24.99928780460501,121.47853679669919
新北市中和區中山路三段37巷1號,25.005526983351576,121.47847850836719
新北市中和區中山路二段340巷31號,25.003513309740914,121.49332765805879
新北市中和區新北市中和區大勇街31巷13弄1號,24.99428241104508,121.51683673688615
新北市新店區德正街19巷1號,24.972535277829042,121.54384057146979
新北市汐止區福德一路61號,25.068934992209723,121.63853688262434
新北市三芝區楓林二街1號,25.19507411878932,121.49392688675064
新北市汐止區民權街二段91號,25.04754651734092,121.61900843355056
新北市汐止區新臺五路二段91號,25.064350000000047,121.65861000000007
新北市林口區忠孝路361號,25.071876000000007,121.3689820413196
新北市新店區中正路700巷61號,24.993019800738537,121.53561905202274
新北市中和區景平路241巷64弄1號,24.99241852039934,121.50759768151653
新北市中和區圓通路393巷14弄1號,24.988431688037394,121.48967296073054
新北市永和區保平路211號,25.004884338046097,121.50860819553922
新北市中和區中正路211號,24.993721900786902,121.49446295890218
新北市中和區大勇街46巷1號,24.993755999999998,121.51747350000002
新北市中和區保健路46巷26弄1號,24.995569499999995,121.5080865
新北市新店區寶橋路235巷1弄1號,24.980450782964937,121.55098475936298
新北市林口區忠孝三路31號,25.069390786542954,121.36067430140238
新北市板橋區金門街61號,24.993081482370627,121.43325918751779
新北市板橋區民生路一段1號,25.011454851121695,121.47777583426246
新北市新莊區中環路一段1號,25.03568000000007,121.45046000000002
新北市三重區三重區重新路一段121號,25.063180239252073,121.50036737093893
新北市中和區中山路二段131巷1號,25.002966761036394,121.50251069040335
新北市淡水區新春街85巷25弄31號,25.184069705811,121.43860089549318
新北市新莊區西盛街344巷1號,25.0141384962491,121.42768480099835
新北市新莊區中和街155巷31號,25.049645864180288,121.44663913581971
新北市汐止區福德二路61號,25.067267621891173,121.63440107448555
新北市汐止區仁愛路316巷1號,25.067625044145547,121.6650864559987
南園段751號,25.037370000000067,121.56355000000008
新北市三峽區大學路61號,24.94111451043091,121.37651358483976
新北市三峽區民生街19巷7弄1號,24.935839962259763,121.37689736355267
新北市樹林區學勤路511號,24.94843436857923,121.38134548263919
新北市林口區文化二路一段1號,25.076670000000036,121.38867000000005
新北市新莊區復興路二段196巷2弄1號,25.044100376074795,121.45922002553522
新北市新莊區中興街10巷1號,25.036213452680467,121.44965000291421
新北市新莊區中港路451號,25.04854137829649,121.4524580867332
新北市淡水區下圭柔山31號,25.16972000000004,121.44077000000004
新北市淡水區北新路182巷1號,25.17803798403788,121.44929736407947
新北市新店區寶橋路78巷61號,24.974285001469582,121.54738178760377
新北市深坑區深坑街1號,25.002270000000067,121.61578000000009
新北市中和區中山路二段359巷1號,25.00417090674591,121.48864799278664
新北市中和區圓通路91號,24.996726911737575,121.49964759048412
新北市中和區圓通路305巷25弄1號,24.989429126839397,121.4948198978591
新北市林口區公園路151號,25.071336471002326,121.37028839632991
新北市林口區民有街61號,25.075144217517202,121.37017973609116
新北市新莊區思源路296巷31號,25.05733210726173,121.46004351362973
新北市新莊區幸福東路91號,25.04941186430013,121.46199286430014
新北市汐止區新臺五路一段271號,25.064350000000047,121.65861000000007
新北市板橋區漢生西路1號,25.017859048012035,121.46397125062039
新北市板橋區國光路173巷1號,25.01860788978854,121.46047191412264
新北市土城區金城路三段241號,24.989771000288457,121.4713834998558
新北市板橋區中山路二段91號,25.015975375526537,121.47417583083273
新北市板橋區新府路121號,25.01354456855759,121.46226780484606
新北市泰山區貴鳳街1號,25.031464679439054,121.42140237108315
建國段211號,25.037370000000067,121.56355000000008
新北市林口區仁愛路一段691號,25.076626337180706,121.38638474060838
新北市新莊區復興路三段31號,25.044536482110825,121.46114699999998
新北市新莊區昌平街31號,25.051839001723536,121.4547979747276
新北市蘆洲區長榮路481號,25.09055182854411,121.45970048563234
新北市中和區中正路271號,24.993690496249098,121.4958949103526
新北市中和區莊敬路49巷29弄1號,25.006668563504853,121.50121239804378
新北市三重區集賢路1號,25.061370000000068,121.48842000000002
新北市三重區溪尾街60巷1號,25.077713065472782,121.49051660227926
新北市三重區三和路四段91號,25.075606169311506,121.4886845373362
新北市新莊區自強街37巷14弄1號,25.046665910352587,121.45411617193724
新北市汐止區南興路61號,25.058391417007165,121.6531437387638
新北市樹林區工興街14巷1號,25.013200095996744,121.39826275999852
新北市板橋區五權街31號,24.994184060505518,121.46435268665243
新北市新莊區民安西路211號,25.01464399417162,121.42602632806279
新北市新莊區民安西路91號,25.019150238963615,121.42703578325337
新北市林口區公園路181號,25.071924551214675,121.37146267110053
新北市蘆洲區中山一路241號,25.080564217035075,121.47333129170748
新北市中和區復興路331號,24.99026458728149,121.50051573980033
新北市永和區環河西路二段217巷1號,25.010074874834043,121.50141625243802
新北市中和區興南路二段31巷1號,24.985647450458767,121.50791456203471
新北市中和區和平街76巷9弄1號,24.99167330169083,121.5079160918691
新北市中和區莊敬路49巷20弄31號,25.00500972409514,121.50288090267932
新北市中和區莊敬路49巷10弄1號,25.005640567314845,121.50166767138897
新北市永和區自由街31號,25.007059020675563,121.51496050562965
新北市汐止區汐萬路二段228巷18弄1號,25.090334493631516,121.64845930464064
新北市板橋區四川路二段245巷55弄1號,24.99251859977496,121.4523316094985
新北市五股區芳洲八路121號,25.08849111352009,121.44629364970992
新北市新莊區五工三路70巷1號,25.06493352123606,121.45935981404007
新北市林口區文林五街31號,25.0848388615927,121.37301966288263
新北市淡水區濱海路一段151號,25.189494707167324,121.43881396127883
新北市淡水區新市一路三段101巷31號,25.18335964699853,121.44627408234993
新北市中和區民安街31號,25.00043451373423,121.48015381571354
新北市永和區中和路391號,25.00021351540767,121.50884708950316
新北市新店區中央八街61號,24.978108292235635,121.52577719536902
新北市土城區日新街31號,24.987901997778298,121.4437060582838
新北市土城區中央路四段31號,24.96217045432525,121.42354580627845
新北市汐止區湖前街68巷1號,25.070720434455254,121.63244726148295
菁埔段湖子小段271號,25.037370000000067,121.56355000000008
新北市新莊區銘德街103巷1號,25.043085000000005,121.45581900000002
新北市淡水區民權路121號,25.13696343435861,121.46012977367408
新北市淡水區水源街二段92巷1號,25.174111161173933,121.45213699810382
新北市蘆洲區長興路181號,25.086095738271133,121.46125289993655
新北市板橋區文化路一段46巷1號,25.01149019988866,121.46031442578045
新北市汐止區樟樹一路145巷1號,25.067773235298667,121.64162512937943
新北市汐止區汐萬路二段66巷111弄31號,25.083489824311858,121.649772635582
新北市汐止區大同路二段312巷9弄1號,25.06597558312654,121.65602732653355
新北市土城區清水路241巷1號,24.98333329808415,121.4613490289977
新北市汐止區民族五街70巷2弄1號,25.070757254515513,121.62790225353457
新北市新莊區中正路361號,25.034808144584346,121.44659346517396
新北市新莊區公園一路91號,25.037772704974287,121.4438227127359
新北市新莊區福壽街124巷34弄1號,25.050770127735614,121.45925393037759
新北市淡水區新民街61號,25.17630116680135,121.43855546557798
新北市中和區中山路三段61號,25.00570187148717,121.4766608942524
新北市中和區中山路三段136巷121號,25.007683734158828,121.47376822415228
新北市永和區中正路31號,24.995939825148575,121.51426895031456
新北市汐止區樟樹一路135巷1號,25.065467612816704,121.6420948760748
新北市汐止區新昌路1號,25.067063305297506,121.66225732278265
新北市新莊區化成路11巷1號,25.043250952025595,121.46490057896233
新北市蘆洲區信義路181號,25.082444734664453,121.47974802025512
新北市瑞芳區汽車路91號,25.109940858275127,121.83890808194961
新北市三重區成功路31號,25.050562701079137,121.49003110130417
新北市新店區建國路211號,24.980414165416367,121.53768883138102
新北市永和區中和路331號,24.99970246378897,121.5073177019159
新北市中和區景新街210巷1號,24.99493307216227,121.50698898695826
新北市中和區永和路191巷1號,25.007239456287152,121.4913396787466
新北市板橋區實踐路91號,25.00546871940101,121.46401737621902
新北市土城區中央路三段61號,24.9694088104334,121.43883331724275
新北市板橋區光武街48巷31號,25.026864401061754,121.46784538911653
新北市汐止區新北市汐止區福德一路91號,25.068367834295184,121.63802880795188
新北市永和區民樂街69巷1號,24.997772503750912,121.52742657799064
新北市永和區保安路241號,25.012891509659084,121.50679488988648
新北市中和區圓通路369巷173弄1號,24.980983270615678,121.4898461770731
新北市三重區忠孝路三段40巷31號,25.066260142462422,121.4820231766965
新北市蘆洲區中興街130巷1號,25.089335978908178,121.48267530336425
新北市三重區正義北路301號,25.070764379133212,121.49469684638466
新北市淡水區淡金路二段361號,25.185560260603697,121.44696121227457
新北市中和區宜安路23巷1號,24.99570379294825,121.51278230988514
新北市板橋區雙十路二段31號,25.025716016648428,121.47688041006413
新北市三峽區學成路91號,24.94121932113787,121.37334528914003
新北市三峽區復興路367巷1弄31號,24.938080710254408,121.36397429089946
新北市三峽區民生街104巷1號,24.93676439763361,121.37283474399544
新北市板橋區新府路61號,25.012408843971773,121.46389269267141
新北市汐止區福安街1號,25.065756271770777,121.66196806425222
新北市汐止區莊敬街119巷1號,25.06073909186912,121.65509782223437
新北市新店區寶橋路1號,24.967340000000036,121.54140000000007
新北市三峽區學勤路91號,24.94580055225991,121.37403582733056
新北市新莊區新泰路175巷1號,25.037473190951587,121.44752169677997
新北市五股區五福路86巷1號,25.090503349154584,121.43294435385778
新北市永和區中興街133巷1號,25.0126573548932,121.518515456461
新北市永和區仁愛路352巷112弄1號,25.00821120030872,121.50058412358287
新北市淡水區清水街1號,25.170420594494853,121.44515062101101
富貴段211號,25.037370000000067,121.56355000000008
新北市三重區光復路一段64巷1號,25.0489845,121.471497
新北市中和區福祥路1號,25.00289823980033,121.49946673743439
新北市泰山區明志路一段122巷1號,25.06350901799308,121.43332702575479
新北市五股區成泰路二段91號,25.087250732307243,121.44044101203507
新北市五股區芳洲二段121號,25.08295000000004,121.43806000000006
新北市五股區五福路91號,25.09044180653825,121.4323446860755
新北市五股區成泰路三段271號,25.094048573691488,121.44701866610887
新北市五股區成泰路一段189巷4弄1號,25.07686267055226,121.4346620954758
新北市五股區西雲路241號,25.097721202608355,121.44912314141038
新北市泰山區明志路一段19巷5弄1號,25.066281932512275,121.43387294881398
新北市五股區成泰路三段451號,25.098165010271778,121.45012925062038
新北市汐止區連興街61號,25.063611166104184,121.6559458562219
新北市三峽區介壽路一段311巷1號,24.93058273688615,121.38121582125343
