臺北市大安區東豐街31號,25.036064496537545,121.54577752553524
臺北市大安區安和路211號,25.02634000000006,121.5347700000001
臺北市大安區樂業街31號,25.023130575076465,121.54991026977898
臺北市中正區博愛路31號,25.042160000000024,121.51980000000003
臺北市大同區迪化街一段72巷8弄1號,25.05539865528881,121.5094780988227
臺北市內湖區成功路二段391號,25.074234578411588,121.59006573030871
臺北市中山區內湖路一段91巷31號,25.084790554211438,121.56050269812826
臺北市中山區中山北路一段1號,25.0482077480858,121.52099339869253
臺北市內湖區康樂街181號,25.075456635483334,121.62023399031663
臺北市內湖區民權東路六段180巷121號,25.066422367792338,121.59268852263675
臺北市中山區龍江路271巷1號,25.059497510964274,121.54099894463042
臺北市內湖區內湖路二段103巷61號,25.08333300404237,121.58107854876195
臺北市中山區南京東路三段211號,25.05195548932419,121.5432086960875
臺北市中山區南京東路二段121號,25.052123482110826,121.53393824562875
臺北市北投區溫泉路61號,25.13504926415471,121.50457396114786
臺北市北投區實踐街61號,25.115250478215692,121.5098091618097
臺北市信義區永吉路421號,25.045513522072778,121.57739086372555
臺北市南港區忠孝東路五段961號,25.04424996335634,121.58204002943043
臺北市松山區南京東路三段256巷31號,25.050766570415043,121.54465105941824
臺北市信義區永吉路30巷28弄1號,25.044729496249087,121.5686786647239
臺北市信義區松山路391號,25.041834031363603,121.57792679199595
臺北市松山區三民路31號,25.05515167415894,121.56376601774495
臺北市內湖區內湖路一段91巷31號,25.087098719401,121.56287709103242
臺北市內湖區新豐街151號,25.06117325116864,121.58572030558598
臺北市大同區長安西路1號,25.05027175138109,121.51993556498994
臺北市大同區太原路1號,25.065930000000037,121.51541000000009
臺北市大同區重慶北路二段181號,25.0597262828207,121.5136977953142
臺北市大安區延吉街233巷1號,25.03703590544443,121.55561232520124
臺北市大安區仁愛路四段112巷9弄1號,25.03675150375091,121.54984691909516
臺北市大安區辛亥路一段91號,25.02158873385639,121.53106940034063
臺北市大安區和平東路二段96巷15弄31號,25.023485419931877,121.54159970774424
臺北市大安區羅斯福路271號,25.02634000000006,121.5347700000001
臺北市大安區大安區通化街162巷1號,25.02856047636051,121.55356734946825
臺北市大安區建國南路二段322巷1號,25.0236613760748,121.53715582944773
臺北市大安區忠孝東路四段26巷61號,25.039336130701116,121.54444413119195
臺北市文山區興隆路二段181號,25.000694632812014,121.54923887968147
臺北市萬華區桂林路1號,25.037600011108548,121.50625006939241
臺北市內湖區星雲街121號,25.079955401061763,121.59497488911656
臺北市內湖區成功路三段151號,25.079625691644086,121.58992768013154
臺北市中山區基湖路157巷1號,25.076955510675813,121.56341811226844
臺北市內湖區內湖路一段120巷15弄1號,25.082124879345603,121.56293654271758
臺北市士林區忠誠路二段91號,25.109026565912508,121.53053732017075
臺北市士林區中山北路七段14巷82弄1號,25.121545651173548,121.53504581116434
臺北市北投區北投路二段1號,25.130383072710533,121.49949501581172
臺北市士林區天母東路105巷31號,25.11978615220708,121.53526473174124
臺北市北投區立農街一段1號,25.118642398933474,121.50261115492992
臺北市北投區崇仰六路31號,25.128596795699938,121.51600722660379
臺北市士林區德行東路190巷6弄1號,25.107817285042398,121.53156414723873
臺北市北投區裕民二路31號,25.115583206215025,121.51698727935825
臺北市萬華區昆明街181號,25.03948002331353,121.50415712476193
臺北市中正區重慶南路二段31號,25.032124131282806,121.51436140106175
臺北市中正區博愛路181號,25.03481861004674,121.51077625243803
臺北市文山區興隆路三段31號,25.000529007501818,121.55550850014423
臺北市大安區樂利路1號,25.02634000000006,121.5347700000001
臺北市北投區崇仰六路1號,25.129411522072783,121.51603799999998
臺北市士林區中正路213巷31號,25.09413730613423,121.5268162230077
臺北市士林區中正路212巷2弄1號,25.095847201223375,121.5263655575913
臺北市信義區虎林街40巷1號,25.047544485140588,121.57668913627447
臺北市松山區南京東路四段133巷4弄1號,25.052202503462457,121.55498941326681
臺北市內湖區內湖路二段103巷31號,25.08333300404237,121.58107854876195
臺北市內湖區陽光街151號,25.074944851214116,121.58520314878591
臺北市大安區羅斯福路二段77巷1號,25.026371716631047,121.5235167012234
臺北市士林區磺溪街55巷1號,25.107469638351926,121.52298420843675
臺北市文山區萬慶街13巷1號,24.99223670774424,121.53990771288017
臺北市大同區長安西路301號,25.052239078827373,121.50784915751052
臺北市中正區北平東路1號,25.04705606301567,121.52091313419702
臺北市文山區羅斯福路五段91號,25.005886742714523,121.53910628810085
臺北市大安區忠孝東路三段301號,25.04172452207278,121.54334836372556
臺北市內湖區新明路121號,25.05962321842005,121.58982061241271
臺北市內湖區康樂街136巷15弄31號,25.072818202608346,121.61852653664373
臺北市內湖區瑞光路583巷1號,25.08044287130872,121.56783730593811
臺北市中山區中山北路二段181號,25.06323200805009,121.52267887330486
臺北市中山區北安路621巷1號,25.082921168474787,121.54885449347915
臺北市南港區經貿二路157巷36弄61號,25.061803299473087,121.61499026487927
臺北市松山區敦化北路145巷31號,25.053739554532893,121.55059741326676
臺北市信義區基隆路二段31號,25.03172134358601,121.55888391978766
臺北市松山區民生東路四段61號,25.057955419931876,121.55081648834323
臺北市信義區林口街66巷1號,25.03883799500834,121.5795800327486
臺北市松山區民生東路五段69巷21弄1號,25.059672503462455,121.55791969900167
臺北市南港區經貿二路157巷31號,25.060166445890946,121.61717061212364
臺北市士林區福國路31號,25.101959407149945,121.52418461310519
臺北市內湖區瑞光路513巷31號,25.079842016648424,121.57002564100631
臺北市中山區吉林路301號,25.063217077990657,121.53035034638462
臺北市中山區明水路397巷7弄31號,25.078052351501547,121.54921819446926
臺北市中山區新生北路二段149巷31號,25.062091644794297,121.52905359783834
臺北市中山區德惠街181號,25.066597452680465,121.53221069608747
臺北市內湖區安康路434巷19弄1號,25.066295612816702,121.61527306855561
臺北市大安區金華街243巷1號,25.030041715794322,121.53056539301166
臺北市大安區信義路四段265巷12弄1號,25.0342835342778,121.55434532653356
臺北市大安區仁愛路三段121號,25.03823201915858,121.54183477629982
臺北市大同區承德路三段181號,25.069202245628716,121.51855037191989
臺北市文山區興隆路三段301號,24.99136678795659,121.55887908909914
臺北市中正區羅斯福路三段151號,25.02168546156727,121.52723755635058
臺北市中正區信義路一段1號,25.038140069392384,121.51922003664377
臺北市中正區仁愛路二段61號,25.038350062178985,121.53009001832196
臺北市中正區忠孝東路二段121號,25.0440441661302,121.52704906187374
臺北市大同區華亭街1號,25.051802609891524,121.51329435204212
臺北市文山區光輝路71巷5弄1號,24.985688191034896,121.55628037846179
臺北市大安區仁愛路三段143巷1號,25.0390873978032,121.54310720190242
臺北市大安區大安路二段31號,25.031916838190327,121.54601783195793
臺北市內湖區瑞湖街61號,25.07386058593168,121.57584370096333
臺北市北投區公館路391號,25.120070716631048,121.50188336343709
臺北市信義區忠孝東路五段372巷28弄1號,25.038920536211045,121.57388521717928
臺北市信義區永吉路200巷31號,25.044450263824288,121.57269645968995
臺北市松山區八德路四段421號,25.04830469663574,121.55925298765078
臺北市信義區信義路六段26巷1號,25.033913413266788,121.57557984638463
臺北市松山區新東街11巷1號,25.05823645268047,121.56589598834324
臺北市中山區南京東一段132巷1號,25.064430000000073,121.53331000000003
臺北市大安區濟南路三段61號,25.040196471002332,121.53659786081136
臺北市大安區四維路154巷1號,25.03101647100233,121.54774911226843
臺北市大安區延吉街62巷6弄1號,25.043606214265115,121.55341918636397
臺北市大安區忠孝東路三段251巷10弄1號,25.043323452680465,121.54154875145713
臺北市松山區南京東路五段23巷15弄1號,25.053030503462455,121.55796922009347
臺北市中正區信義路二段31號,25.034875207888476,121.52575963933286
臺北市萬華區西園路二段320巷9弄1號,25.026371214265115,121.4922475423279
臺北市大同區鄭州路1號,25.065930000000037,121.51541000000009
臺北市大安區和平東路二段175巷5弄1號,25.02569041993188,121.54187845628718
臺北市士林區忠誠路二段10巷1號,25.108872802579757,121.52909094284472
臺北市內湖區民權東路六段190巷63弄1號,25.06688474006099,121.59440272203223
臺北市中山區長安東路二段121號,25.04844947100233,121.53565761226844
臺北市中山區林森北路601號,25.066235479062303,121.52575803284641
臺北市中山區新生北路二段127巷1號,25.05985247100233,121.52812927990652
臺北市中正區忠孝東路一段151號,25.044114177164865,121.52680866622954
臺北市萬華區漢中街91號,25.043468978277698,121.50729846245436
臺北市中正區同安街48巷1號,25.02399005912053,121.5214324154885
臺北市文山區羅斯福路六段31號,24.999810914795994,121.53994535734891
臺北市中正區羅斯福路二段48巷1號,25.027979577399773,121.52166887651808
臺北市中正區仁愛路一段1號,25.03925922344037,121.51885070927345
臺北市大同區南京西路91號,25.053189935339557,121.51821372093023
臺北市大安區潮州街55巷1號,25.029526023313522,121.52411763197529
臺北市大安區文昌街121號,25.032669401610022,121.55199853719199
臺北市中山區中山北路一段31號,25.048838489830196,121.5213201700566
臺北市信義區虎林街242巷1號,25.036399131831054,121.57756480766345
臺北市信義區忠孝東路五段743巷21弄1號,25.043795528997677,121.58079686081135
臺北市松山區興安街151號,25.05611050375092,121.54523883527611
臺北市信義區忠孝東路五段1號,25.04122748932419,121.5648592543713
臺北市松山區南京東路三段303巷6弄1號,25.052436471002324,121.54684919608746
臺北市信義區吳興街284巷18弄1號,25.02450923036528,121.56337400805012
臺北市信義區吳興街156巷1號,25.029100131831065,121.56160683319864
臺北市信義區吳興街336巷31號,25.025390486814025,121.56521219248083
臺北市信義區臺北市信義區忠孝東路四段553巷22弄1號,25.043425376074794,121.56321628850488
臺北市信義區忠孝東路五段423巷31號,25.04231161809683,121.57534723022106
臺北市中山區明水路601號,25.081708956142915,121.55141977794459
臺北市內湖區港華街51巷8弄1號,25.083450439638725,121.57556568151654
臺北市中山區天津街1號,25.048338058369286,121.52255659728215
臺北市中山區樂群二路151號,25.08002481932554,121.55684220192849
臺北市大安區臨江街1號,25.02948554899298,121.55705595559465
臺北市中正區連雲街74巷1號,25.034420503750912,121.52993025437127
臺北市大同區南京西路344巷31號,25.052964820705185,121.51213621149513
臺北市萬華區德昌街151號,25.023754373016374,121.49567799861501
臺北市大同區延平北路三段31號,25.063930040538892,121.51117001110855
臺北市士林區中正路181號,25.09302940737169,121.5197276620181
臺北市文山區景華街61號,24.995138272303496,121.5437498186586
臺北市大安區敦化南路二段63巷31號,25.030986485429054,121.55057044463041
臺北市大安區復興南路二段211號,25.026146413266787,121.54357935027976
臺北市中山區松江路78巷1號,25.04979445268047,121.53227844754457
臺北市內湖區成功路三段61號,25.077160073287494,121.59013006939232
臺北市信義區忠孝東路四段559巷1號,25.042050282820707,121.56361819747246
臺北市南港區興華路64巷1號,25.055354053292156,121.60559920038668
臺北市信義區永吉路187巷1號,25.045821031363612,121.57266867193721
臺北市信義區信安街103巷1號,25.02531586678397,121.55665418235326
臺北市南港區忠孝東路六段271號,25.04975051096427,121.58968723120198
臺北市南港區舊莊街一段91巷12弄1號,25.040916711639387,121.6198052123319
臺北市松山區光復北路11巷91號,25.050284412718522,121.5618961275319
臺北市松山區健康路15巷31號,25.05416048634416,121.55295501365588
臺北市北投區光明路211號,25.136228158203007,121.50393394823709
臺北市北投區致遠一路一段61號,25.1087420224768,121.51601285997465
臺北市北投區明德路1號,25.13289000000003,121.50253000000009
臺北市士林區中山北路六段419巷1號,25.113573953921218,121.52671870038665
臺北市士林區中山北路七段140巷1號,25.123069445467113,121.53237753136364
臺北市中山區民生東路二段121號,25.05799652207278,121.53185902553525
臺北市中山區樂群三路271號,25.08270315270087,121.5585901527009
臺北市大安區敦化南路一段233巷31號,25.04040143825375,121.55103137246812
臺北市大安區大安路一段91號,25.040655,121.54611834638466
臺北市大同區承德路三段1號,25.063344,121.51841881363605
臺北市中正區仁愛路二段65巷1弄1號,25.038907902422302,121.53125382996828
臺北市內湖區東湖路151號,25.068014161261427,121.61734393810951
臺北市南港區重陽路190巷12弄1號,25.05696424646543,121.60258945475795
臺北市松山區塔悠路181號,25.056479996393318,121.56958735457894
臺北市信義區崇德街1號,25.02438473608269,121.55323654169364
臺北市中山區明水路557巷1號,25.07931079461935,121.55111600070288
臺北市中山區明水路581巷1號,25.080039151334137,121.55177265133415
臺北市內湖區成功路四段167巷1號,25.083389252842075,121.59451650721337
臺北市內湖區環山路一段9巷1號,25.082949572854762,121.56575673980035
臺北市士林區德行東路91號,25.107526246465444,121.527790538577
臺北市信義區信義路六段15巷1號,25.034356174014707,121.57515545446947
臺北市松山區民生東路四段80巷1號,25.057277127700594,121.55304906959282
臺北市南港區興中路31號,25.05645418040717,121.60709889718757
臺北市松山區寶清街1號,25.049652579519865,121.56900555052218
臺北市松山區八德路三段158巷61號,25.047699118789325,121.55510948889152
臺北市松山區信義路五段91巷1號,25.03364023703907,121.57181209553261
臺北市信義區忠孝東路五段524巷1號,25.0401015,121.58013375000003
臺北市大安區通化街171巷1號,25.028055858733882,121.5538145306711
臺北市大安區忠孝東路四段219巷19弄1號,25.041571522072783,121.55250633527612
臺北市大安區信義路三段134巷1號,25.032069970113106,121.5394889673961
臺北市萬華區成都路61號,25.042825917017684,121.50581392131687
臺北市大同區民生西路171巷1號,25.057382259507175,121.51720065528883
臺北市中正區中華路一段91巷1號,25.037952789341574,121.50770489578167
臺北市中正區中華路二段391號,25.026151494315855,121.5078273959259
臺北市大安區大安路一段241號,25.033886497085817,121.54600937191985
臺北市松山區南京東路五段251巷31號,25.052166,121.56511832084941
臺北市松山區南京東路五段1號,25.05163943104039,121.55743076019968
臺北市士林區克強路15巷1號,25.108474873961054,121.52421833518035
臺北市中山區復興北路361號,25.060389904524214,121.54429972260365
臺北市內湖區康寧路一段195巷1弄1號,25.07873701748514,121.59691230904843
臺北市內湖區民權東路六段90巷1號,25.06878900000001,121.58600987191987
臺北市內湖區內湖路一段91巷24弄1號,25.085024738271123,121.56218222078599
臺北市內湖區瑞湖街31號,25.07429199494309,121.57579241161947
臺北市中山區復興北路1號,25.064430000000073,121.53331000000003
臺北市士林區德行東路74巷15弄1號,25.106595296150907,121.52756403497028
臺北市士林區德行東路331巷1號,25.111278923882526,121.53757368305543
臺北市大安區大安路一段51巷1號,25.043139471002334,121.54632800291421
臺北市大安區和平東路二段76巷1號,25.024833004287547,121.53919745103745
臺北市大安區安和路一段91號,25.036142867332217,121.5525990848
臺北市中正區博愛路121號,25.042431513744827,121.51156401374482
臺北市大同區承德路三段208巷31號,25.070519460470752,121.51721758673324
臺北市萬華區康定路61號,25.04100258451152,121.50218927797326
臺北市中正區和平西路二段91號,25.03213058534825,121.50700690313924
臺北市大安區通化街162巷1號,25.02856047636051,121.55356734946825
臺北市大安區仁愛路四段266巷15弄1號,25.036618917191635,121.55296085178894
臺北市松山區光復北路121號,25.052141597737947,121.55726565508967
臺北市內湖區康寧路三段16巷1號,25.072650638640397,121.60679622716262
臺北市內湖區金湖路347巷180弄1號,25.073680849758478,121.59840548070268
臺北市內湖區瑞湖街91號,25.07350379243091,121.5759289850916
臺北市內湖區內湖路一段271號,25.08250864641233,121.56547344836164
臺北市內湖區東湖路113巷49弄61號,25.069182844029406,121.61474804918446
臺北市內湖區東湖路61號,25.068685011945224,121.6146124694731
臺北市士林區後港街121號,25.086285848462104,121.52189621371689
臺北市信義區信義路四段391號,25.033184496537555,121.55845053136363
臺北市南港區三重路31號,25.059395982280446,121.61417734994916
臺北市大安區瑞安街61號,25.026790814694984,121.53971487300456
臺北市大安區延吉街138巷1號,25.039806496249096,121.55468791326678
臺北市大安區大安路一段61號,25.042751413266785,121.54616836470652
臺北市大安區新生南路二段1號,25.03094948932419,121.53554899417162
臺北市大安區四維路170巷31號,25.02827341993188,121.54672979156328
臺北市大安區敦化南路一段236巷31號,25.04061250375091,121.54626950291419
臺北市中正區汀州路一段211號,25.026818731057773,121.51167465015294
臺北市文山區辛亥路四段252巷1號,25.00147666971554,121.55448020621503
臺北市中正區臨沂街24巷1號,25.040151858733882,121.52985669830917
臺北市萬華區國興路1號,25.026134227352426,121.50637498135599
臺北市南港區忠孝東路六段91號,25.048040195181933,121.58496032890845
臺北市內湖區成功路四段30巷1號,25.081808049685467,121.59141556647812
臺北市內湖區成功路四段31號,25.08124716902305,121.5915562924
臺北市大安區忠孝東路四段216巷32弄1號,25.03990749653755,121.55280791909519
臺北市中正區金山南路一段30巷1號,25.041889749379624,121.5292730080501
臺北市中山區長安東路二段181號,25.04830449653755,121.54254694463037
臺北市中山區中山北路二段16巷1號,25.05309948542906,121.5219517019159
臺北市松山區三民路3巷1號,25.05193339191593,121.56377237745313
臺北市信義區信安街81巷1號,25.025831999999994,121.55748075000001
臺北市松山區重陽路1號,25.05534260335364,121.59594411543534
臺北市松山區八德路二段437巷1弄1號,25.048775503750907,121.5470565
臺北市信義區松隆路91號,25.045900934177716,121.57050862250256
臺北市松山區民生東路三段130巷1號,25.056867513634167,121.54624551363419
臺北市北投區致遠一路一段58巷1號,25.10896122814357,121.51603939355994
臺北市士林區中山北路六段405巷31號,25.11467751679265,121.52565859686077
臺北市內湖區行愛路61號,25.062272504891727,121.58151633977751
臺北市內湖區新富街31號,25.058647636540307,121.5822895617858
臺北市大同區華陰街72巷1號,25.050241676380637,121.51470588481737
臺北市大同區迪化街一段1號,25.05396046794391,121.51025946003806
臺北市大安區忠孝東路三段10巷1號,25.041632385509864,121.53358544269716
臺北市大安區安和路一段121號,25.034907907509414,121.55261139830192
臺北市大安區瑞安街208巷53弄1號,25.030354452680466,121.54067086372555
臺北市大安區忠孝東路三段251巷8弄1號,25.04301745268047,121.5415397514571
臺北市大安區復興南路二段151號,25.02847176294515,121.54362725670684
臺北市中正區汀州路一段252巷1號,25.026852719401006,121.51046585789715
臺北市中山區新生北路一段91號,25.04625273772287,121.53241278726408
臺北市內湖區新湖三路121號,25.06421453908012,121.57823856331872
臺北市士林區福林路100巷11弄31號,25.09592475808421,121.53264240830232
臺北市北投區大業路721號,25.137225471002324,121.50222557216227
臺北市士林區雨聲街59巷1號,25.102819886202347,121.52836553220031
臺北市士林區通河街1號,25.09313000000003,121.51976000000002
臺北市北投區大度路三段301巷1號,25.12309682237862,121.46630825203403
臺北市松山區新東街9巷1號,25.057930452680463,121.56590507216225
臺北市松山區延吉街1號,25.047630477009328,121.55344936205594
臺北市士林區忠誠路二段154巷1號,25.115103010820047,121.53255332500436
臺北市內湖區內湖路一段91巷12弄1號,25.084790486814036,121.56193080751922
臺北市中正區羅斯福路一段1號,25.034295729672785,121.51727072176696
臺北市中山區長安東路二段91號,25.048517489324187,121.53051903136361
臺北市大安區和平東路一段61號,25.027019412718513,121.52449012101101
臺北市大安區和平東路二段96巷15弄1號,25.0235193871833,121.54127120774427
臺北市大同區重慶北路三段241號,25.07119180099834,121.51391978810084
臺北市文山區辛亥路七段84巷22弄1號,24.981157037191988,121.55486926977896
臺北市文山區景華街121號,24.995138272303496,121.5437498186586
臺北市中正區金華街43巷1號,25.032099216486813,121.52006149777833
臺北市內湖區江南街71巷16弄61號,25.075796766400035,121.5767109432067
臺北市內湖區內湖路二段271號,25.082170113797666,121.59046843505111
臺北市士林區中山北路六段1號,25.102783646661816,121.52530339214628
臺北市南港區園區街31號,25.05901747403209,121.612085916181
臺北市信義區富陽街87巷31號,25.021808989179963,121.55764540882336
臺北市信義區忠孝東路五段31巷18弄31號,25.041677510964274,121.56671775437127
臺北市松山區三民路180巷1號,25.06232236886144,121.56327581487682
臺北市士林區承德路四段80巷31號,25.08249481626178,121.5222736486237
臺北市士林區中山北路五段860巷1號,25.10238489265953,121.52664393489515
臺北市士林區忠勇街40巷1弄1號,25.09855574049283,121.53337247668651
臺北市中山區復興北路91號,25.05461625232555,121.5442082524289
臺北市內湖區東湖路16巷1號,25.068238603308053,121.61266134049622
臺北市內湖區康寧路三段99巷31號,25.072386548156256,121.6103550822898
臺北市中山區南京東路三段89巷27弄1號,25.053729673610675,121.53812359172487
臺北市中山區天祥路31號,25.06132875437129,121.52108934638464
臺北市中正區仁愛路一段31號,25.038689321686125,121.52330240383174
臺北市中正區衡陽路31號,25.042160000000024,121.51980000000003
臺北市大安區復興南路一段181號,25.040619000000007,121.54384986860164
臺北市大安區敦化南路一段177巷31號,25.043095529286138,121.55101691909516
臺北市大安區臥龍街181號,25.01798520831311,121.55168787337354
臺北市大安區光復南路240巷31號,25.04071947792723,121.55609658090486
臺北市大安區仁愛路三段31號,25.038449591176622,121.53537706996921
臺北市萬華區大理街175巷1號,25.034053777684804,121.49459973313522
臺北市大同區南京西路344巷1號,25.053666820705175,121.51218676977895
臺北市萬華區西寧南路271號,25.039271210658427,121.50626910214088
臺北市大同區延平北路一段31號,25.050426076605667,121.51201637191984
臺北市內湖區南京東路六段121號,25.055769759939864,121.57810634373024
臺北市中山區中山北路二段96巷1號,25.059857510964274,121.52246811226843
臺北市士林區中山北路七段124巷1號,25.122382292255764,121.53246118220903
臺北市士林區德行東路46巷7弄1號,25.10611539439666,121.52642590161003
臺北市士林區承德路四段297巷1號,25.090106510964272,121.51872309616829
臺北市士林區大東路1號,25.09313000000003,121.51976000000002
臺北市士林區中山北路六段186巷1號,25.107605316677247,121.52609948750793
臺北市南港區研究路三段1號,25.054370000000063,121.60681000000011
臺北市信義區忠孝東路五段236巷37弄1號,25.038136445467106,121.57211783819031
臺北市松山區敦化南路ㄧ段100巷7弄1號,25.05003000000005,121.57729000000006
臺北市松山區八德路四段61號,25.048420270615676,121.55977553788449
臺北市南港區成功路一段36巷1號,25.056039365225807,121.59220640869358
臺北市信義區永吉路30巷101弄31號,25.043583478215687,121.56972783527613
臺北市信義區松勤路1號,25.03293000000008,121.56705000000011
臺北市南港區重陽路166巷16弄1號,25.056435111575958,121.60122914501704
臺北市北投區致遠二路91號,25.116219398003334,121.5117113315252
臺北市北投區大業路691號,25.137127445467105,121.50017891035259
臺北市北投區尊賢路218巷31號,25.13289000000003,121.50253000000009
臺北市北投區雙全街1號,25.139116666108855,121.50137562184771
臺北市士林區天母東路50巷31號,25.116839829703473,121.53309317029652
臺北市中山區敬業一路36巷1號,25.08110648932419,121.55301832944775
臺北市中山區長安東路一段56巷1弄1號,25.04790254426078,121.52897523273614
臺北市中山區新生北路二段28巷1號,25.053853452680467,121.5270010896474
