臺北市松山區光復北路26巷1號,25.049090472387313,121.55758031848347
臺北市中正區濟南路二段1號,25.04158594976628,121.52631550222173
臺北市大安區基隆路二段132巷1號,25.028789196779968,121.55645981848346
臺北市大安區忠孝東路四段211號,25.041570463788965,121.55209750582839
臺北市北投區中央南路二段1號,25.126072155981305,121.50045825535224
臺北市北投區中山路1號,25.136907707144207,121.50434421574612
臺北市士林區天母北路87巷1號,25.122444338882804,121.52717248765077
臺北市士林區中山北路六段290巷31號,25.10882237246811,121.52668726256563
臺北市大同區延平北路二段181號,25.05874729447747,121.5115261604247
臺北市大同區鄭州路61號,25.04967943242536,121.51298698404405
臺北市松山區光復北路100巷1號,25.050608731276373,121.55777496189053
臺北市松山區南京東路五段61號,25.051604489324195,121.5592606990017
臺北市南港區園區街1號,25.054370000000063,121.60681000000011
臺北市中山區南京東路二段151號,25.05211253318128,121.53581927699236
臺北市中山區林森北路301號,25.05574662753189,121.5255082625656
臺北市中山區新生北路三段61號,25.065917999999996,121.5280078791332
臺北市中山區民生東路一段61號,25.058106755419203,121.52639748255008
臺北市內湖區行善路48巷1號,25.05836336292039,121.57489802638503
臺北市大安區敦化南路一段161巷69弄1號,25.0438683679334,121.55249902279378
臺北市大安區忠孝東路四段91號,25.041651463788973,121.54778986372554
臺北市中正區廈門街81巷1號,25.024481412718526,121.51757778573489
臺北市內湖區瑞光路571號,25.07943982052294,121.56832468806115
臺北市中山區基湖路120巷31號,25.078619299546165,121.56226859033931
臺北市中山區松江路194巷31號,25.057129452680467,121.5316972769923
臺北市中山區建國北路二段121號,25.059670575076467,121.53724876256562
臺北市內湖區內湖區成功路三段151號,25.079625691644086,121.58992768013154
臺北市中山區新生北路三段1號,25.06300116180968,121.52785935749316
臺北市松山區光復北路60巷1號,25.049684677863926,121.55765230596664
臺北市信義區和平東路三段341巷1號,25.020711890645746,121.5567887216227
臺北市大同區太原路31號,25.05048675669471,121.51528156205049
臺北市大同區華陰街181號,25.050270865947248,121.5153548119626
臺北市大同區安西街1號,25.059278430751917,121.51012674424373
臺北市大同區南京西路1號,25.052789629704552,121.52017921019122
臺北市士林區中山北路七段219巷1號,25.128994968059487,121.53216837076602
臺北市士林區延平北路五段211號,25.083822771856433,121.50992795905712
臺北市士林區芝玉路二段61巷1號,25.1118217507646,121.53476718304573
臺北市士林區天母東路43巷4弄1號,25.118587529286135,121.53247624854293
臺北市北投區中和街493巷1弄1號,25.14499252345776,121.49503687177565
臺北市萬華區忠孝西路二段31號,25.04842620248893,121.50811061029317
臺北市中正區武昌街一段1號,25.044062510964277,121.5139409475446
臺北市松山區民生東路97巷2弄1號,25.05003000000005,121.57729000000006
臺北市松山區民權東路三段106巷3弄31號,25.061532338241612,121.54673530283706
臺北市南港區興華路121號,25.056913672773955,121.60559744991052
臺北市中山區中原街31號,25.056585,121.528908853598
臺北市中山區錦州街30巷1號,25.059942000000007,121.52484836081135
臺北市內湖區洲子街151號,25.08115004385711,121.56838001832192
臺北市內湖區堤頂大道二段181號,25.0772225856367,121.56991361310519
臺北市內湖區南京東路六段451巷1號,25.060870319235207,121.58731917186073
臺北市中山區民權西路31號,25.062931445467104,121.52142803176767
臺北市內湖區堤頂大道二段271號,25.07840420885664,121.56588754138438
臺北市大安區復興南路一段107巷5弄1號,25.043715419095165,121.54449912808015
臺北市大安區敦化南路二段63巷1號,25.031016776253235,121.54907196802242
臺北市文山區三福街61號,24.99787200666511,121.54394549694156
臺北市中正區金華街31號,25.042160000000024,121.51980000000003
臺北市中山區民族東路181號,25.068258145292376,121.53826335470765
臺北市中山區農安街91號,25.0640800766057,121.52301995614302
臺北市內湖區成功路二段301號,25.069416935339557,121.59104252775694
臺北市中山區樂群二路241號,25.080002291060236,121.56030999766463
臺北市內湖區成功路三段121號,25.0790540291419,121.5897173690057
臺北市中山區臺北市內湖區民權東路六段121號,25.068982514859417,121.59261967055227
臺北市內湖區基湖路1號,25.081707457672128,121.56533588149912
臺北市信義區忠孝東路五段790巷23弄1號,25.04272660283339,121.58248546127881
臺北市信義區忠孝東路四段553巷22弄1號,25.043425376074794,121.56321628850488
臺北市士林區忠誠路一段16巷31號,25.105755288937544,121.52611659616827
臺北市萬華區德昌街121號,25.02419016541636,121.49672697016564
臺北市大同區環河北路一段361號,25.060806,121.50851881363603
臺北市松山區復興北路181號,25.054739329447756,121.54417635749311
臺北市南港區昆陽街91號,25.051678522621028,121.59358648404405
臺北市內湖區新湖二路241號,25.062714907796927,121.57974783514811
臺北市中山區新生北路三段31號,25.064684999999997,121.5279873280628
臺北市中山區松江路77巷1號,25.049790926367685,121.53442566681284
臺北市文山區景後街91號,24.992140913959265,121.54297457008481
臺北市中山區堤頂大道二段246巷1號,25.07769364640202,121.56627040466843
臺北市松山區八德路四段691號,25.05004350764605,121.57647652553521
臺北市松山區南京東路五段301號,25.05146146378896,121.56642003136363
臺北市信義區松仁路號號,25.036970029430424,121.56848002221702
臺北市信義區嘉興街151號,25.028216528449416,121.55733485636796
臺北市南港區興華路61號,25.05486346855422,121.60609000434307
臺北市南港區向陽路120巷2弄1號,25.054822361648082,121.5963915401062
臺北市中正區信陽街1號,25.042160000000024,121.51980000000003
臺北市中正區忠孝東路一段61號,25.04423029356864,121.5262991883624
臺北市士林區天母東路1號,25.118209172369927,121.53089296073055
臺北市士林區天玉街38巷13弄1號,25.12051039936348,121.5285839290146
臺北市士林區天母東路8巷31號,25.116784819716873,121.53185304762113
臺北市士林區天母東路31號,25.118087489324186,121.53194891035258
臺北市士林區天母西路50巷1號,25.11795806310851,121.52535479248313
臺北市內湖區港華街31號,25.08263355620634,121.57650495559466
臺北市中山區中山北路二段65巷1號,25.05712045268046,121.52326927990651
臺北市大安區敦化南路二段146巷1號,25.02551245268047,121.54814986372554
臺北市大安區忠孝東路三段217巷4弄1號,25.04285252928614,121.5398477514571
臺北市中正區南昌路二段181號,25.02540758534824,121.52287840313925
臺北市中正區重慶南路三段1號,25.029643787956598,121.5154060818858
臺北市中正區和平西路一段61號,25.026604019158594,121.51957158451154
臺北市大安區永康街23巷1號,25.03187536955243,121.53007746062939
臺北市中山區林森北路399巷1號,25.059224577298163,121.5257327864274
臺北市內湖區行善路61號,25.057749039673492,121.57799921163937
臺北市中山區松江路69巷1號,25.049381510964277,121.53347052844941
臺北市內湖區瑞光路271號,25.07529392506777,121.57676098917999
臺北市北投區榮華三路31號,25.114010878700526,121.52089147807146
臺北市北投區東華街一段22巷31號,25.10932299916328,121.52015212210753
臺北市士林區臺北市中山北路六段728巷1號,25.114279076488007,121.52831340701744
臺北市士林區中山北路六段195巷1號,25.107838638351932,121.52468862392521
臺北市士林區中正路187巷1號,25.095443395781643,121.52731704815625
臺北市大同區酒泉街50巷1號,25.071434497085818,121.5166488208494
臺北市松山區八德路四段271號,25.04902829651498,121.56544711383694
臺北市松山區光復北路號號,25.05003000000005,121.57729000000006
臺北市信義區永吉路31號,25.045774522072772,121.56857002553522
臺北市松山區長安安路二段211號,25.05003000000005,121.57729000000006
臺北市信義區忠孝東路五段71巷3弄31號,25.04162053143234,121.5686453834251
臺北市萬華區廣州街181號,25.036671478215688,121.50092758673321
臺北市大同區南京西路64巷9弄1號,25.052463000000003,121.5188235
臺北市萬華區康定路121號,25.03917536441803,121.5019069200761
臺北市北投區關渡路1號,25.125360000000057,121.46551000000011
臺北市士林區磺溪街50巷1號,25.09313000000003,121.51976000000002
臺北市中山區明水路397巷1號,25.077458687054087,121.54773583015712
臺北市中山區錦州街241號,25.060345280033317,121.53791443854274
臺北市內湖區瑞光路301號,25.075815925067772,121.57590493089616
臺北市內湖區內湖路一段737巷19弄1號,25.079270940879475,121.57850235858967
臺北市中山區南京東路三段181號,25.052015180764926,121.54196044798663
臺北市內湖區洲子街61號,25.079319638092127,121.57286710075594
臺北市大安區辛亥路二段151號,25.021614456575605,121.54013902553521
臺北市大安區信義路四段121號,25.033460489324188,121.54414036372555
臺北市中正區福州街1號,25.042160000000024,121.51980000000003
臺北市中正區羅斯福路二段8巷1號,25.028883786283146,121.52072879669919
臺北市中正區羅斯福路四段31號,25.013963810044906,121.53541473802858
臺北市中正區重慶南路三段151號,25.02300362170351,121.51695763878465
臺北市文山區景興路85巷1號,24.996035503750907,121.545009
臺北市大安區信義路四段199巷1號,25.033672430413116,121.55167903636965
臺北市大安區復興南路二段111巷3弄1號,25.03020639065391,121.54387008957274
臺北市大安區溫州街58巷1號,25.020602634456786,121.53251673827111
臺北市中山區撫順街1號,25.064430000000073,121.53331000000003
臺北市中山區復興北路451號,25.06397299417162,121.54434781363607
臺北市中山區建國北路一段138巷1號,25.050979529286142,121.53629699999999
臺北市內湖區新明路331號,25.056604037740243,121.58378593450281
臺北市中山區天祥路61號,25.06330816817246,121.52082400940459
臺北市士林區中山北路六段290巷7弄31號,25.110072481822368,121.52723395268049
臺北市士林區忠誠路一段21巷1號,25.10416936329285,121.5267036386404
臺北市士林區天母東路50巷1號,25.117189016402808,121.5335480097376
臺北市士林區中山北路六段441巷1號,25.114514424586375,121.52731134263185
臺北市大同區南京西路211號,25.053877445467112,121.51112707507644
臺北市萬華區中華路二段1號,25.03679614793123,121.50687772828779
臺北市信義區基隆路二段79巷17弄1號,25.029678750764614,121.5593640946391
臺北市信義區基隆路一段101巷1號,25.045306920624377,121.56740540022501
臺北市信義區松山路211號,25.044957031363605,121.57789832084943
臺北市大同區延平北路一段91號,25.051770953372948,121.51192929531418
臺北市中正區懷寧街1號,25.042160000000024,121.51980000000003
臺北市中正區懷寧街31號,25.042160000000024,121.51980000000003
臺北市中山區民權東路一段31號,25.06286251485942,121.52390836372552
臺北市內湖區行愛路31號,25.06190580405097,121.58178263443568
臺北市中山區敬業3路177巷1號,25.078699486005977,121.5556285284494
臺北市中山區敬業二路69巷31號,25.082010152345315,121.55307451831028
臺北市內湖區康寧路一段31號,25.08051738273989,121.59150175298635
臺北市內湖區陽光街345巷1號,25.0726804012921,121.57802839781337
臺北市大安區杭州南路二段9巷1號,25.034331247850414,121.52389947890816
臺北市大安區忠孝東路四段271號,25.04156302237295,121.55402371785519
臺北市大安區復興南路一段126巷1號,25.04305752899768,121.54334855245543
臺北市大安區仁愛路四段300巷35弄1號,25.0352986588955,121.55456026311384
臺北市大同區延平北路一段121號,25.05285103719198,121.51184626256558
臺北市內湖區江南街91號,25.076873630301847,121.5768905671706
臺北市內湖區內湖路二段253巷31號,25.08264887490565,121.58963269519249
臺北市中山區林森北路121號,25.050800682209015,121.52511523841535
臺北市中山區民權東路三段31號,25.062486463788964,121.54199777699233
臺北市萬華區萬大路61號,25.031005575076463,121.50061778810083
臺北市士林區德行東路241號,25.109730523457756,121.53405104440537
臺北市松山區富錦街91號,25.06063000000006,121.55910000000006
臺北市信義區東興路61號,25.047289338911472,121.56628456515047
臺北市北投區承德路七段280巷31號,25.11658049792253,121.5066178184835
臺北市大安區復興南路二段301號,25.024336239800334,121.54351981363605
臺北市大安區大安路一段52巷1號,25.04314652207277,121.54604849999998
臺北市大安區忠孝東路四段170巷18弄1號,25.039942438253743,121.55060711518263
臺北市大安區敦化南路二段151號,25.028301513854203,121.54903551385424
臺北市松山區民生東路三段91號,25.057907268013064,121.54426299768006
臺北市南港區八德路四段871號,25.050664820733843,121.58033864250686
臺北市南港區八德路四段841號,25.05050865022634,121.57984559358653
臺北市士林區中山北路七段190巷91號,25.12758390266964,121.53612446112778
臺北市北投區三合街一段82巷61號,25.13289000000003,121.50253000000009
臺北市大同區民生西路91號,25.057529328899488,121.51937478934155
臺北市內湖區洲子街91號,25.080389536203604,121.5703526480309
臺北市中山區合江街91號,25.059347161809683,121.5392463280628
臺北市內湖區康寧路三段165巷25弄1號,25.071691391211687,121.61240912482585
臺北市內湖區金湖路363巷121號,25.073055184060436,121.5996808589984
臺北市中山區松江路361號,25.063614,121.53333631363607
臺北市內湖區民權東路六段421號,25.07108193533956,121.60404562210752
臺北市中山區長春路301號,25.054674897832406,121.5421762868654
臺北市中山區建國北路一段91號,25.051844673184195,121.53707158140476
臺北市內湖區大湖街160巷2弄1號,25.083496592561602,121.60032692867445
臺北市中山區敬業三路151號,25.079877000000007,121.55621048654396
臺北市中山區堤頂大道二段361號,25.079637195062904,121.5636544765433
臺北市大同區延平北路一段61號,25.051123152374625,121.51196616431983
臺北市大同區大龍街1號,25.065930000000037,121.51541000000009
臺北市大同區承德路三段299巷1號,25.0755797349529,121.5205041684748
臺北市大同區昌吉街61巷9弄1號,25.06650501165676,121.51563024424377
臺北市北投區裕民二路49巷1號,25.11480081294356,121.51686057230653
臺北市士林區芝玉路二段84巷1號,25.112314194010015,121.5353755320561
臺北市士林區磺溪街91號,25.10832336975988,121.52321684688874
臺北市北投區中和街301號,25.14068464640202,121.50004962086679
臺北市士林區中山北路六段754巷1號,25.115662121011024,121.52858798112986
臺北市信義區松勇路53巷1號,25.034326425869708,121.56976527637168
臺北市信義區信義路六段121號,25.036244328899482,121.57831528642737
臺北市松山區八德路四段511號,25.04998438669716,121.5723047969625
臺北市南港區興中路44巷1號,25.056080245080462,121.60693520260833
臺北市南港區經貿二路255巷1號,25.061681599486512,121.61407342229782
臺北市中正區中華路二段307巷1號,25.02884692645275,121.5053512178718
臺北市大安區復興南路一段241號,25.037321563967964,121.54377778478262
臺北市大安區敦化南路一段331號,25.034058,121.54907032474456
臺北市大安區羅斯福路二段81巷16弄1號,25.02534244823707,121.52469643450284
臺北市大安區敦化南路二段181號,25.028301513854203,121.54903551385424
臺北市大安區泰順街40巷1號,25.024326379969942,121.53115006855558
臺北市大安區光復南路601號,25.03218487955861,121.55753839232021
臺北市大安區大安路一段31巷1號,25.044021471002324,121.54629977699233
臺北市大安區羅斯福路二段61號,25.027017708532586,121.52264328429469
臺北市大安區復興南路一段121號,25.043381329447755,121.54392630642266
臺北市大安區敦化南路二段31號,25.032285,121.54904933917126
臺北市大安區泰順街50巷1號,25.023004292255763,121.53114243075191
臺北市南港區南港路二段91號,25.053978479860476,121.5977210260835
臺北市信義區信義路五段1號,25.033020080500844,121.56234000000006
臺北市北投區石牌路二段315巷1號,25.1219050989904,121.5228744207092
臺北市士林區天玉街38巷18弄1號,25.11953906717061,121.52979281334757
臺北市中正區忠孝東路二段61號,25.044012505363405,121.52716665900755
臺北市中山區北安路501巷43弄1號,25.07972042567216,121.54318737121608
臺北市中山區林森北路310巷1號,25.056335016524713,121.52511630797672
臺北市士林區通河街61號,25.08024057542917,121.52235398232474
臺北市士林區中山北路六段2巷31號,25.103376774914853,121.52742249194995
臺北市士林區忠誠路一段16巷14弄31號,25.105349495314204,121.52716404766606
臺北市北投區行義路170巷27弄1號,25.131311013491302,121.52946160715246
臺北市松山區民生東路四段91號,25.058045336112844,121.55187323397195
臺北市松山區八德路三段241號,25.048176296150906,121.55741303788449
臺北市松山區三民路35巷1號,25.055496587281485,121.56331073036529
臺北市中正區紹興北街1號,25.042160000000024,121.51980000000003
臺北市北投區石牌路二段91號,25.117172004443397,121.51638967110053
臺北市萬華區德昌街185巷31號,25.022519864273804,121.49423374493625
臺北市中山區北安路781號,25.085542713312815,121.55359441271854
臺北市內湖區新湖一路151號,25.059097732673884,121.57703999780698
臺北市中山區松江路123巷1號,25.0529311374378,121.53364213743782
臺北市中山區松江路421號,25.065377664723883,121.53335781753118
臺北市內湖區新湖二路151號,25.06215237059883,121.5788027800804
臺北市萬華區萬大路424巷3弄1號,25.02112952622771,121.49775308021236
臺北市萬華區萬大路486巷46弄1號,25.0210804182499,121.49596116092651
臺北市萬華區萬大路237巷61號,25.02644211531724,121.50099694175908
臺北市松山區松山區慶成街31號,25.05003000000005,121.57729000000006
臺北市信義區松德路91號,25.038187062438745,121.57598476770151
臺北市信義區松隆路271號,25.048172461314174,121.57841920049135
臺北市松山區八德路四段241號,25.04893043104038,121.56480745989381
臺北市中山區民權東路二段31號,25.062704496537545,121.52943894754458
臺北市文山區仙岩路22巷1號,24.99858320509997,121.54931525565922
臺北市中正區金華街32巷2弄1號,25.030880340267796,121.5213175269202
臺北市大安區臥龍街271號,25.018556405505155,121.55669106272723
臺北市大安區四維路181號,25.02801100582839,121.54802881363604
臺北市大安區市民大道四段121號,25.04440994503446,121.55175994892966
臺北市大安區復興南路一段331號,25.033502354181284,121.54372665435197
臺北市北投區北投路一段31號,25.127873647768997,121.50035916157807
臺北市信義區忠孝東路五段451號,25.040913442148877,121.57623911518266
臺北市信義區松勤街1號,25.03293000000008,121.56705000000011
臺北市大同區重慶北路一段26巷61號,25.05150579378498,121.51235872828782
臺北市萬華區南寧路31號,25.03661919623171,121.50484023521268
臺北市萬華區德昌街1號,25.025350547319537,121.50006573980033
臺北市中正區杭州北路1號,25.042160000000024,121.51980000000003
臺北市北投區中和街錫安巷66弄1號,25.145506194010014,121.49851319193252
臺北市士林區文林路481號,25.096133315569293,121.52430022064176
臺北市士林區天母東路69巷1號,25.118505524006014,121.5344794196434
臺北市內湖區民權東路六段151號,25.068855015840363,121.5945842946217
臺北市內湖區內湖路三段60巷12弄61號,25.088946317790985,121.59198653788451
臺北市中山區中山北路一段91號,25.050654576461447,121.52214710297766
臺北市內湖區文德路151號,25.07862151485941,121.58466657799067
臺北市中山區民權西路61號,25.06297750375092,121.5201877543713
臺北市中山區德惠街193巷1號,25.067777174179206,121.53253385326457
臺北市內湖區基湖路35巷1號,25.079994796981346,121.56485767868564
臺北市中山區新生北路二段72巷1號,25.057040510964267,121.52718925145712
臺北市內湖區康樂街61號,25.073594352395077,121.6196065446106
臺北市大同區民權西路121號,25.063047471002335,121.51745086372557
臺北市松山區民權東路三段160巷31號,25.059720678970592,121.54682161632351
臺北市松山區八德路三段61號,25.04813711175606,121.55517103410727
臺北市松山區復興南路一段31號,25.04643216180969,121.54400828088748
臺北市松山區民生東路三段113巷7弄1號,25.058502471002328,121.54638641909514
臺北市大安區復興南路一段61號,25.044691063710122,121.54398506134893
臺北市大安區忠孝東路四段61號,25.041686489324196,121.5459590867332
臺北市大安區羅斯福路三段121號,25.022045796843397,121.52681846961734
臺北市大安區新生南路三段19巷1號,25.024997503750914,121.53523011226844
臺北市大安區延吉街151號,25.036766127811912,121.55563206968702
臺北市中正區中華路一段85巷1號,25.038296492060073,121.50793335881177
臺北市中正區延平南路151號,25.03725187953724,121.50820422595051
臺北市松山區南京東路五段121號,25.051571496537544,121.56066802553522
臺北市中山區長春路181號,25.054734456575602,121.53763786372554
臺北市中山區新生北路一段31號,25.04722514654625,121.53096495559464
臺北市中正區重慶南路三段15巷1號,25.0290659753015,121.51583052331353
臺北市中正區南海路1號,25.032690062179007,121.5172899744648
臺北市文山區秀明路二段151號,24.990681514146125,121.57688601414615
臺北市南港區忠孝東路七段511號,25.05279532889949,121.61207470552256
臺北市中正區臨沂街57巷1號,25.03769243825374,121.5293593724681
臺北市士林區忠誠路一段91號,25.104771063823733,121.52808200028849
臺北市中山區松江路140巷1號,25.05331031878963,121.53288707076295
臺北市內湖區康寧路三段181號,25.07005744408212,121.61181001125274
臺北市內湖區堤頂大道二段一百八十一樓51號,25.075944224677656,121.57162024624665
臺北市南港區向陽路120巷1號,25.054693731894492,121.5955210917249
臺北市文山區景興路181號,24.992831640573637,121.54428609146507
臺北市大安區樂業街79巷31號,25.022605747424773,121.55208899108557
臺北市大安區忠孝東路四段216巷61號,25.03831273688614,121.55298870428179
臺北市松山區基隆路一段1號,25.05005814570952,121.56994556869982
臺北市信義區信義路五段150巷14弄1號,25.028515529286143,121.56934949999999
臺北市松山區南京東路四段52巷1號,25.051157329447747,121.55367685359799
臺北市信義區松山路465巷2弄1號,25.039325346932884,121.57846666763805
臺北市士林區劍潭路61號,25.083370959126594,121.52148397357216
臺北市中正區臨沂街6巷1號,25.04245092423106,121.53048372814357
臺北市中山區松江路184巷31號,25.05662073772287,121.5314812872641
臺北市內湖區石潭路61號,25.0626413072594,121.58688548681403
臺北市中山區新生北路二段76巷1號,25.05747647100233,121.52721692200936
臺北市中山區中山北路一段105巷1號,25.050963782128214,121.522464340412
臺北市中山區五常街53巷1號,25.06446841326678,121.53963032084941
臺北市中山區中山北路二段115巷1號,25.061061492328573,121.52314873855823
臺北市中山區八德路二段211號,25.04665710341067,121.53983264943153
臺北市中山區民權東路二段135巷30弄1號,25.064236445467106,121.53489727990655
臺北市中山區德惠街151號,25.06661350375092,121.53074794463038
臺北市大安區信義路四段265巷5弄1號,25.033873452680464,121.55447694754457
臺北市大安區金華街121號,25.030600270615675,121.52415298765078
臺北市大安區瑞安街208巷78弄1號,25.030689463788967,121.54033833527615
臺北市大安區忠孝東路三段1號,25.042040073287488,121.53545006939235
臺北市中正區水源路91號,25.042160000000024,121.51980000000003
臺北市文山區羅斯福路六段276巷1號,24.99137866971554,121.53965720621505
臺北市中正區寧波西街31號,25.031078067170615,121.51813331334756
臺北市中正區羅斯福路二段181號,25.024313422881473,121.52469742786022
臺北市士林區永平街25巷1號,25.090244612816704,121.50478945628714
臺北市大安區大安路二段61號,25.028316000000007,121.5460475138553
臺北市大安區光復南路240巷1號,25.040708528997683,121.557366
臺北市大安區安東街31號,25.044214505135894,121.54253648265909
臺北市中山區中山北路二段151號,25.062078415488482,121.52294929240001
臺北市中山區松江路164巷61號,25.05566147821569,121.53059052844941
臺北市大同區環河北路一段121號,25.05416002914191,121.50762986179231
臺北市大同區長安西路121號,25.0512018259853,121.5156636983092
臺北市士林區後街21巷31號,25.09873937607479,121.52481002469854
臺北市北投區文林北路301號,25.109725573721274,121.51209011224266
臺北市士林區文林路121號,25.08847936525475,121.52639889702239
臺北市南港區東新街181號,25.04651502582368,121.59350644878533
臺北市信義區松勤街121號,25.032044312045976,121.56516665373495
臺北市信義區永吉路30巷118弄1號,25.043145496249092,121.56829532653359
臺北市信義區永吉路1號,25.03293000000008,121.56705000000011
臺北市信義區永吉路30巷102弄1號,25.04354458728149,121.56860571135093
