新北市汐止區大同路二段211號,25.06473014654625,121.65271048612152
新北市汐止區復興路1號,25.06481213073454,121.65556369888611
新北市汐止區福德二路151號,25.065242560361284,121.63101625812219
新北市汐止區仁愛路151巷1號,25.063455370857408,121.66227920619372
新北市板橋區永豐街61號,25.0184323760748,121.47380252469851
新北市新店區安康路一段151號,24.96224523007681,121.52751145530621
莊敬段721號,25.037370000000067,121.56355000000008
新北市板橋區文化路一段361號,25.021131987794984,121.46684534220103
新北市土城區中華路一段31號,24.98884472439266,121.44624514738295
新北市三峽區國光街91號,24.938804682757283,121.37344413765943
新北市樹林區學勤路451號,24.948297964654337,121.3807180245847
新北市三峽區學府路121號,24.934390000000064,121.36913000000004
新北市三峽區學勤路151號,25.142520489583994,121.48944564057366
新北市永和區得和路5巷1號,25.000847863725536,121.51511815084541
新北市汐止區龍安路28巷1號,25.064356500000002,121.65419475000002
新北市汐止區新臺五路一段61號,25.064350000000047,121.65861000000007
新北市汐止區汐萬路一段181號,25.071407895637407,121.65262491880671
新北市汐止區大同路三段601號,25.07372247737897,121.68348154480938
新北市三重區福隆路31號,25.077249063275474,121.48989818595992
新北市板橋區大觀路二段265巷130弄1號,24.996392999999998,121.44168450000001
新北市汐止區工建路331號,25.064350000000047,121.65861000000007
新北市汐止區樟樹二路61號,25.06348210281567,121.63950565633726
新北市新莊區中央路181號,25.058798859491255,121.45266435949124
新北市新莊區五工一路97巷1號,25.06780607271053,121.4604099003693
新北市新莊區富貴路61號,25.057324502308614,121.45855950000004
新北市林口區中山路511號,25.08146811318078,121.38151611653299
新北市林口區文化二路二段110巷1號,25.081717086108892,121.3795510907047
新北市土城區中正路67巷31號,24.976147208290477,121.44437508613633
三重段61號,25.035282471002333,121.50215897307982
五谷王段271號,25.041057463788967,121.57125817055226
新北市新店區安泰路1號,24.949966739587616,121.48533089744735
新北市淡水區淡金路一段541號,25.18005472381575,121.4536278009697
新北市淡水區淡金路二段91號,25.181470143747628,121.45159284650019
新北市淡水區北新路169巷61號,25.18070332999601,121.44832131807945
新北市淡水區新市一路一段331巷61號,25.186266527707655,121.43592763816676
新北市淡水區新春街181號,25.181049320107498,121.44371196484636
新北市淡水區坪頂路52巷1號,25.16233950000001,121.4582445
新北市淡水區北新路91號,25.19476798073186,121.4925403618847
新北市中和區連城路451號,24.996179536211038,121.4846190313636
新北市中和區景平路421號,24.995133691644075,121.50174984540367
新北市中和區中山路二段380巷1號,25.00352750561587,121.49086133146136
新北市樹林區大成路1號,24.94526165306028,121.38236779865758
新北市三峽區學成路121號,24.941316798285687,121.37360926389324
新北市三峽區大智路61號,24.93612808826243,121.36053871596724
新北市土城區中山路61號,24.96383173930178,121.42471583377285
新北市板橋區漢生東路1號,25.0175592603439,121.46451231862771
新北市汐止區樟樹二路121號,25.065765846419605,121.63997088648924
新北市泰山區貴子路1號,25.042071508596567,121.42541075658306
新北市新莊區中平路92巷1號,25.045476463788965,121.4450185284494
東豐段331號,25.037370000000067,121.56355000000008
新北市樹林區保安街二段1號,24.999486129609362,121.41670645169951
新北市永和區保生路22巷19弄1號,25.008252454065442,121.50698422522942
新北市淡水區淡金路61號,25.161559348624085,121.45612568571619
新北市淡水區新市三路一段301號,25.19806519272275,121.42779109931433
新北市淡水區民權路1號,25.16972000000004,121.44077000000004
新北市新店區中正路329巷9弄1號,24.973451128155098,121.53477906997742
新北市蘆洲區民族路61號,25.085695745772952,121.47896888106648
新北市板橋區文化路二段481號,25.033771424375285,121.47567796182707
新北市板橋區文化路一段181號,25.016302057735544,121.46300356243879
新北市林口區竹林路61號,25.07836748265909,121.38760553843277
新北市汐止區龍安路202巷31號,25.06361467299888,121.65219098357909
新北市汐止區大同路一段211號,25.057343335564582,121.63365417040804
新北市汐止區樟樹二路91號,25.06361154882997,121.63948649587446
新北市汐止區茄苳路31號,25.070957350539576,121.66538707507647
新北市汐止區新北市汐止區新臺五路一段61號,25.064350000000047,121.65861000000007
新北市汐止區大同路一段151號,25.056133166253083,121.6320775356628
新北市汐止區新臺五路一段91號,25.064350000000047,121.65861000000007
新北市林口區文化三路二段115巷61號,25.081569016855124,121.37273481104971
新北市板橋區長江路二段91號,25.031599698886094,121.46528872938434
新北市板橋區大仁街1號,25.017048063275467,121.45604918595994
新北市土城區明峰街1號,24.985733763430105,121.46536079239183
五谷王段391號,25.052300483648715,121.60721399918529
新北市三重區重新路五段631號,25.04414965302149,121.46774127585711
新北市新店區中興路三段121號,24.9776664445448,121.54578614294729
新北市中和區中山路二段211號,25.002521528997676,121.49889845337299
新北市中和區中山路二段64巷31號,25.00574361604862,121.50320380829321
新北市新莊區立信一街31號,25.049456800998332,121.44244780252757
新北市泰山區新北大道三段31號,25.059090000000026,121.43142000000012
新北市新莊區思源路421號,25.052688670552257,121.4597487007907
新北市新莊區立信一街61號,25.05148221657402,121.44251589399533
新北市新莊區榮華路二段61號,25.055926196598637,121.4507765982856
新北市新莊區中原東路91號,25.054384568959616,121.46228186955392
新北市新莊區福德二街31號,25.057202869651743,121.46182229295422
新北市新莊區中正路929巷1號,25.02015280778985,121.4112018862033
新北市新莊區新北大道三段61號,25.060329506203757,121.45578749999999
新北市新莊區中原東路89巷1號,25.05429886179686,121.46084778838974
新北市新莊區立信三街1號,25.05042255785112,121.44454214654627
新北市新莊區中平路82巷31號,25.044919186360282,121.44630848949221
新北市新莊區立信三街12巷1號,25.050357586733227,121.44415981363606
新北市新莊區榮華路二段1號,25.055941506859067,121.45077367132404
新北市中和區中安街181號,24.999603186124574,121.51111486851903
新北市中和區泰和街44巷1號,25.00029402331353,121.49866525506377
新北市淡水區新市一路一段121號,25.186605250366505,121.43301063342261
新北市淡水區新市一路一段91號,25.186808366577388,121.43103025036649
新北市五股區芳洲五路61號,25.086599344080504,121.44547445296001
新北市五股區成泰路三段361號,25.09579304385709,121.44864561795261
新北市五股區芳洲一路61號,25.085995323071113,121.44465868067984
新北市五股區成泰路三段331號,25.095335322234384,121.44821638911652
新北市淡水區新春街91號,25.18261910497115,121.43908081676288
新北市三峽區忠孝街1號,24.934561575076458,121.37080832653356
新北市中和區水源路36巷1弄1號,25.00339658174156,121.50528787177564
新北市淡水區自強路241號,25.127313338882804,121.46319128919733
新北市板橋區新崑路91號,24.99924085451867,121.43163532631534
新北市板橋區忠孝路忠義巷15弄31號,25.004369179294827,121.46562092200935
新北市新莊區中原路151號,25.05432951067581,121.45389753136362
新北市五股區新城三路31號,25.093795494315856,121.44781892146112
新北市汐止區大同路一段111巷1號,25.054651183738223,121.63013455176292
新北市汐止區南陽街241號,25.05729118640612,121.62677668752328
新北市五股區蓬萊路31號,25.080554708582287,121.4339806750619
新北市五股區水碓一路1號,25.072916794881493,121.43265418373824
新北市新莊區思源路91號,25.04114798834324,121.45984678850483
新北市新莊區五權三路1號,25.062255921461084,121.4512054006291
新北市新莊區中正路91號,25.039070560909536,121.46076294338965
新北市新莊區中信街61號,25.05077702469851,121.4493204394945
新北市新莊區立信一街91號,25.050361345774096,121.44407164593983
新北市林口區文化三路一段331號,25.071863384961592,121.36380896197132
新北市新莊區泰和街121號,25.03568000000007,121.45046000000002
新北市五股區芳洲八路91號,25.087741850290076,121.44623511352006
新北市新莊區幸福路871號,25.048992535053053,121.44491456523916
新北市新店區中興路二段1號,24.969365326347255,121.5458966181666
新北市三重區三和路四段1號,25.074071821541896,121.491521035807
新北市三重區中正北路91號,25.063125935339553,121.48981511157598
新北市淡水區淡金路二段151號,25.182418150960988,121.45007485371359
新北市三重區中正南路211號,25.056798202159122,121.4939041020358
新北市新莊區立信三街31號,25.049953032711834,121.44244838667267
新北市樹林區學勤路301號,24.94802970360205,121.37948402374417
新北市樹林區柑園街二段301號,24.95083770439737,121.37118834791383
新北市三峽區學府路91號,24.94798358412191,121.37212742425253
新北市三峽區文化路211號,24.936017499140746,121.36968511640251
新北市三峽區中山路238巷1號,24.937645192048116,121.3625964099772
新北市中和區中正路841號,25.002601763806343,121.48465684621176
新北市中和區板南路661號,25.00846781706984,121.4836078895206
新北市中和區圓通路393巷1號,24.98894254010618,121.4896776859599
新北市中和區建八路181號,24.99951561226845,121.49127613803483
新北市中和區南山路1號,24.99857000000003,121.50056000000006
新北市中和區華新街61號,24.98424401610017,121.50796412989784
新北市永和區安樂路241號,24.999468537884482,121.51412639064574
新北市中和區景平路481號,24.997454769634732,121.50027983873856
新北市中和區中山路二段181巷1號,25.00227101433639,121.50077979808924
新北市中和區中正路781號,25.000233736886145,121.48486925575628
新北市淡水區中山北路二段189巷151號,25.185280499999998,121.44264750000002
新北市新店區安和路三段91號,24.9840235320561,121.51776954717532
新北市新店區民權路91號,24.982874528997684,121.53741853719197
新北市新莊區中平路271號,25.04992402553523,121.44475565361536
新北市汐止區福德一路91號,25.068367834295184,121.63802880795188
新北市汐止區福德一路86巷61號,25.06833138383642,121.63720989396396
新北市五股區新五路二段241號,25.082222687661144,121.44032851542357
新北市五股區五福路14巷1號,25.088690472387306,121.43452798612157
新北市三重區集英路61號,25.08639481046206,121.48619303416223
新北市淡水區水源街一段122巷31號,25.170860766028056,121.44715732223436
新北市中和區廣福路31號,25.001647735490995,121.50335884425057
新北市中和區景安路200巷1弄1號,24.991505756796485,121.50386192381566
新北市中和區中和路721號,25.004720982006567,121.51280824809191
新北市永和區永和路二段181號,25.01333136663973,121.51532831028915
新北市永和區福和路301號,25.007321703849108,121.5164727506204
新北市中和區中正路691號,24.99803085345376,121.4850267368575
新北市鶯歌區大湖路468巷7弄1號,24.972429572854768,121.3393756588955
新北市土城區忠義路45巷1號,24.967590963645083,121.44094782943512
新北市汐止區中興路211號,25.069725882142684,121.6281034509755
新北市永和區信義路5巷1號,25.011676225921878,121.5144790824341
新北市三峽區復興路160巷2弄1號,24.938727633071807,121.37136038106645
新北市樹林區大安路481號,24.98619466613897,121.41415570949285
新北市永和區中正路661號,25.01022305497699,121.51462769228738
新北市中和區宜安路91號,24.997565525390993,121.51072099624908
新北市淡水區博愛街58巷1號,25.168546257285485,121.44681923036529
新北市淡水區淡金路38巷1號,25.160880645305486,121.45682750859835
新北市新店區中正路560巷1號,24.987313581741564,121.53400678795663
新北市土城區峰廷街1號,24.9872340637531,121.46906382303528
新北市五股區芳洲九路6261號,25.08295000000004,121.43806000000006
新北市汐止區鄉長路一段55巷1號,25.075983731409345,121.66568819549467
新北市汐止區湖前街110巷97弄1號,25.07748361590379,121.63027358370346
新北市新莊區昌平街82巷13弄1號,25.053597838190313,121.45557834638463
新北市淡水區英專路211號,25.173182888711246,121.44896176806846
新北市板橋區文化路一段121號,25.01500664446877,121.46193412363678
新北市林口區文化二路一段61號,25.069970241473776,121.37147214265111
新北市林口區中正路61號,25.077426915344258,121.39526124785044
新北市中和區中山路三段121號,25.00602278045477,121.47449528351319
新北市中和區捷運路1號,24.98934211254137,121.50974588456123
新北市中和區景平路241號,24.990620321686126,121.52356323619364
新北市三峽區嘉添181號,24.934390000000064,121.36913000000004
新北市板橋區三民路二段61號,25.017043006971008,121.479366513942
新北市蘆洲區中正路243巷1號,25.086517294448807,121.46746194437061
新北市新莊區中平路82巷1號,25.044916452680464,121.44497861518266
新北市板橋區和平路1號,25.009520000000066,121.45932000000005
新北市淡水區北新路1號,25.177777427981965,121.4445139833516
新北市淡水區學府路136巷91號,25.172891893444362,121.45105972260367
新北市淡水區自立路1號,25.129322282719162,121.46244923021807
永豐段331號,25.037370000000067,121.56355000000008
新北市土城區延吉街331號,24.984180115730894,121.4651644468521
新北市板橋區民族路181號,25.00751816264641,121.46874832223436
新北市板橋區文化路二段151號,25.027116621155244,121.47022277808887
新北市新店區環河路31號,24.96732400209301,121.53701089537434
新北市新店區中正路481號,24.983523265430854,121.5336650413898
新北市新莊區中港路211號,25.04212417929483,121.45476887093889
新北市新莊區自信街65巷9弄1號,25.048740101304176,121.45534127185641
新北市林口區文化三路一段617巷121號,25.07863508595177,121.37090390794653
新北市中和區建一路121號,25.001310049122846,121.48812986008008
新北市中和區中和路378巷1號,25.00195272606611,121.51095411019098
新北市中和區景平路391號,24.99439594310117,121.5025765356628
新北市中和區圓通路299巷1號,24.990626997914926,121.49222154374857
新北市中和區圓通路61號,24.99736549264241,121.5005470037509
新北市中和區景平路989巷1號,25.0053095589763,121.49585047599402
新北市永和區環河東路四段1號,24.9977250012232,121.52837969902147
新北市中和區南山路181號,24.9951679417162,121.50273475812217
新北市中和區捷運路31號,24.989524255873793,121.50935378731029
新北市中和區中正路61號,24.993434536211034,121.50143966472388
新北市中和區中興街181號,24.99012222093021,121.50036558909919
新北市中和區仁愛街31號,24.988732784349914,121.51085440259098
新北市永和區文化路16巷5弄1號,25.015382528997677,121.51522867055229
新北市永和區中正路571號,25.00868462170351,121.51679740117736
新北市中和區中原五街1號,25.0108791648681,121.48601205161874
新北市永和區環河西路二段181號,25.01349556809055,121.5051427469883
新北市永和區保生路22巷1號,25.007852576749904,121.50684975491954
新北市新店區北新路二段121號,24.974914345191145,121.54282414537973
新北市林口區文化三路一段361號,25.072724147725197,121.3649402932784
新北市淡水區新市一路1號,25.16972000000004,121.44077000000004
新北市林口區文化二路一段481號,25.077234733412286,121.37479367555292
新北市林口區東明三街342巷61號,25.06993561586106,121.3915637167793
新北市林口區文化二路一段20巷1號,25.0672397946217,121.36494710505507
新北市新莊區五工五路1號,25.064050096860775,121.45623005551384
五工段541號,25.052913303364264,121.61299351234925
新北市林口區文化二路二段88巷1號,25.081044621155257,121.37911948043738
新北市新莊區民安西路151號,25.01665552039934,121.42621844991054
新北市新莊區中港路331號,25.045149489035726,121.45237615445211
新北市新莊區建安街41巷1號,25.025596907247266,121.4289204945908
新北市新莊區中華路一段91號,25.042618914729527,121.45036696981546
新北市新莊區新北大道二段211號,25.060709766028054,121.46308038121072
新北市淡水區新市一路三段101巷16弄1號,25.18378307882738,121.44630845184372
新北市淡水區中正東路一段121號,25.15971381467432,121.45444038360526
新北市淡水區新春街121號,25.181901427722167,121.44144067208146
新北市新店區新店路241號,24.957772974407177,121.53715508324335
新北市新店區寶橋路235巷1號,24.980011633389687,121.55172453271352
新北市板橋區莊敬路25巷1號,25.027599278665768,121.47412236969818
新北市五股區新城六路241號,25.08295000000004,121.43806000000006
新北市五股區芳洲一路31號,25.085760662242382,121.44396913835193
新北市五股區芳洲七路1號,25.087682990095118,121.44617736648081
新北市五股區五福路121號,25.09109634387447,121.43209000386649
新北市新莊區中原東路31號,25.054540554532903,121.46460811809686
新北市新莊區新泰路121號,25.036116705522545,121.44834096932891
新北市土城區興城路1號,24.972210000000075,121.44351000000006
新北市樹林區中山路一段151號,24.98911053344107,121.42204356578564
新北市永和區成功路二段61號,25.00023491035259,121.52678626256561
新北市中和區景平路631號,24.99115896113458,121.52015973313526
新北市樹林區中山路一段121號,24.990083539269456,121.42261281294358
新北市汐止區長江街13巷1號,25.071321887039062,121.65472667485142
新北市新莊區景德路241號,25.033683522801603,121.44859944295926
新北市林口區新北市林口區文化二路一段91號,25.076670000000036,121.38867000000005
新北市五股區芳洲路31號,25.0834554210887,121.44184823983423
新北市板橋區民族路151號,25.008235686406437,121.46681056621549
新北市板橋區篤行路二段31號,24.992681311962613,121.43182004385709
新北市新店區安民街361號,24.975717558976307,121.51669386871721
新北市淡水區新生街51巷1號,25.17499598834324,121.44049839647414
新北市汐止區大同路184巷1號,25.064350000000047,121.65861000000007
新北市永和區環河西路一段61號,25.018159485140597,121.51349969608748
新北市新莊區新北大道四段151號,25.05847590627773,121.44549050165733
新北市林口區竹林路1號,25.076670000000036,121.38867000000005
新北市新莊區新泰路406巷2弄1號,25.0438869235378,121.44435168345609
新北市三重區重新路三段91號,25.06005185374223,121.49169956466046
新北市新店區安和路一段1號,24.963854489872453,121.51671003038264
新北市新店區達觀路14巷1號,24.941556668907474,121.5035516753128
新北市淡水區民權路181號,25.13463450874258,121.4596084031392
新北市淡水區新市一路三段31號,25.183030514859414,121.44493774854294
新北市汐止區新昌路61號,25.068893605055084,121.66345739785909
新北市三峽區文化路241號,24.935649934497686,121.36638775738524
新北市永和區博愛街1號,25.015846452680474,121.51654507507646
新北市中和區中原二街61號,25.01280187974949,121.48572615568544
新北市中和區南山路236巷24弄1號,24.989186748132003,121.50470984141316
新北市中和區成功路97巷5弄1號,24.991587691644074,121.52681231028915
新北市中和區景平路278巷1號,24.9929191126513,121.51393847324091
新北市汐止區福德一路121號,25.06761520760001,121.63736110075591
新北市樹林區長壽街1號,24.993125036355273,121.42414718290149
新北市新莊區福前街481號,25.03568000000007,121.45046000000002
新北市新莊區三泰路1號,25.034006431300188,121.44054889203075
新北市泰山區臺麗街16巷1號,25.059090000000026,121.43142000000012
新北市新莊區中平路121號,25.046709076605673,121.44477568636394
新北市土城區學成路91號,24.98854999832657,121.45079462738768
柑林段1081號,25.037370000000067,121.56355000000008
新北市板橋區莊敬路181號,25.021675204830043,121.47258628850484
新北市板橋區莒光路28巷1號,25.02432888481737,121.47001378074326
新北市淡水區中正東路二段121號,25.14995072745108,121.45958682863971
新北市土城區中華路一段121號,24.986788051618714,121.44438202138028
新北市淡水區大義街1號,25.17815719954993,121.44362030169083
新北市淡水區中山北路二段189巷91號,25.1852262837109,121.44276923249545
新北市淡水區淡金路38巷31號,25.16138993727279,121.45773119663575
新北市淡水區淡金路31號,25.160511856223724,121.45652145723942
新北市汐止區大同路二段241號,25.06527457813489,121.6533477356454
新北市汐止區秀山路5巷2弄1號,25.057979769086472,121.66617833666112
新北市中和區連城路523巷7弄1號,24.99508565306712,121.48174771149517
新北市永和區仁愛路91號,25.01324476213291,121.5128038513763
新北市中和區景平路601號,25.00111260476662,121.49692067594798
新北市中和區泰和街30巷1號,25.00042027477062,121.49938508742571
新北市永和區秀朗路一段135巷1號,25.005144865947237,121.51625302039935
新北市中和區成功路1巷2弄1號,24.99857000000003,121.50056000000006
新北市中和區圓通路167巷1號,24.995268963096482,121.49791329323673
新北市中和區福美路301巷8弄1號,25.004360294477465,121.49717523105778
新北市中和區中和路252巷1號,24.99933202914191,121.50758577407817
新北市中和區中和區南山路81巷8弄1號,24.99857000000003,121.50056000000006
新北市中和區中正路571巷2弄1號,24.993928791563278,121.48649639578167
新北市永和區博愛街45巷1號,25.015979902302508,121.51913801304177
新北市中和區景安路1號,24.99935023896361,121.50819066486808
新北市中和區華新街143巷106弄1號,24.979126358589653,121.50604818304576
新北市中和區中原二街121號,25.01280187974949,121.48572615568544
新北市中和區保建路31號,24.99857000000003,121.50056000000006
新北市永和區福和路331號,25.00810036580301,121.52363747307982
新北市中和區橋和路91號,25.005528858733886,121.49045116250215
新北市淡水區中正東路一段1號,25.164290639477105,121.45065388256701
新北市淡水區英專路121號,25.17245558895493,121.44585704287614
新北市淡水區沙崙路一段126巷61號,25.182957353857795,121.42333467236992
新北市板橋區中山路一段31號,25.008760802383314,121.46050297140637
新北市新店區寶元路一段91號,24.985106454902173,121.54340438565406
新北市板橋區三民路二段21巷61號,25.018314401610013,121.48102565306709
新北市新莊區中原東路181號,25.05429886179686,121.46100286179686
新北市林口區文化二路一段271號,25.071268559236096,121.36800074891828
新北市三峽區光明路31號,24.930872276992314,121.37358005398465
新北市新店區北新路二段151號,24.975999,121.54283968636396
新北市樹林區中華路151號,24.982182178458114,121.42127056134221
新北市永和區永亨路151號,25.003973419931885,121.52544093075193
新北市汐止區大同路二段272巷1號,25.06607190091753,121.65500539148245
新北市板橋區民生路三段301號,25.030622410208366,121.46378163307182
新北市新店區中正路541號,24.98691782292688,121.53351593782106
新北市三重區中央南路91號,25.060659820705183,121.5015097374344
新北市蘆洲區光榮路31號,25.088349565205043,121.45987654527282
新北市淡水區新市一路三段101巷16弄31號,25.185081525517848,121.44612889082464
新北市淡水區淡金路二段511號,25.190027978908187,121.44691818578703
新北市汐止區原興路61號,25.065507206215035,121.63268782791852
新北市五股區新城八路61號,25.08913060201549,121.4471313570259
新北市五股區新城八路91號,25.08913060201549,121.4471313570259
新北市五股區御成路31號,25.091245834295176,121.44169088380777
新北市五股區新五路三段1號,25.088887964254138,121.44518649853705
新北市新莊區思源路192巷61號,25.04840050822297,121.46177699999998
新北市五股區成泰路三段221巷1號,25.09313505828381,121.44596502692019
新北市板橋區文聖街40巷1號,25.031139841797003,121.47622343519532
新北市新莊區後港一路151號,25.02787958621363,121.43129937578632
新北市新莊區民安西路189巷10弄1號,25.01511437246812,121.42656624424376
新北市板橋區金門街372巷1號,24.983844283796046,121.42706529713304
新北市鶯歌區高職西街1號,24.942260179843093,121.33835897876396
新北市三峽區復興路42巷1號,24.93720126865378,121.37378757175824
新北市樹林區大義路211號,24.945565228379404,121.37784847783414
新北市樹林區大成路391號,24.950213225085147,121.38128758226118
新北市樹林區學勤路361號,24.948093358767,121.37977683750293
新北市三峽區復興路121號,24.93796325116864,121.37177277823305
新北市三峽區大同路181號,24.926997432830042,121.37112324631258
新北市新莊區中央路211號,25.058798859491255,121.45266435949124
新北市泰山區明志路三段204巷10弄1號,25.038814544325028,121.42286128072514
新北市新莊區福營路181號,25.030845325004343,121.43147519401002
新北市汐止區新臺五路一段151號,25.064350000000047,121.65861000000007
新北市汐止區連興街31號,25.063611166104184,121.6559458562219
新北市新店區中興路一段241號,24.958261635293507,121.53850739413684
新北市板橋區文化路一段91號,25.01411203175101,121.46117344492754
